season;federation;position;club;points
2018-2019;MKD;361;SHK FC Shkupi 1927 Shkupi;1.0
2018-2019;MKD;362;PEL FK Pelister Pelister;0.25
2018-2019;MKD;363;SIL FK Sileks Sileks;0.25
2018-2019;MKD;364;REN KF Renova Renova;0.25
2018-2019;MKD;365;MET FK Metalurg Skopje Metalurg Skopje;1.0
2018-2019;MKD;366;TUR FK Turnovo Turnovo;0.25
2018-2019;MDA;367;PET Petrocub-Hincesti Petrocub;1.0
2018-2019;MDA;368;DAC FC Dacia Chisinau Dacia;1.0
2018-2019;MDA;369;SAX FC Saxan Saxan;0.25
2018-2019;MDA;370;TIR FC Tiraspol Tiraspol;0.25
2018-2019;MDA;370;SIN FC Veris Veris;0.25
2018-2019;KOS;372;DRI FC Drita Drita;1.5
2018-2019;ALB;373;LUF KS Luftëtari Luftëtari;1.0
2018-2019;FIN;374;SJK SJK Seinäjoki SJK;1.5
2018-2019;ARM;375;SHI FC Shirak Shirak;1.5
2018-2019;ALB;376;TIR KF Tirana Tirana;0.25
2018-2019;FRO;377;HB HB Tórshavn HB;1.5
2018-2019;ALB;378;TEU KF Teuta Teuta;0.25
2018-2019;ALB;379;FLA KS Flamurtari Flamurtari;0.5
2018-2019;IRL;380;UCD University College Dublin AFC UCD;0.5
2018-2019;IRL;381;SLI Sligo Rovers FC Sligo;0.5
2018-2019;FIN;382;LAH FC Lahti Lahti;1.25
2018-2019;FIN;383;KUP KuPS Kuopio KuPS;1.0
2018-2019;FIN;383;ILV Ilves Tampere Ilves;1.0
2018-2019;FIN;385;MAR IFK Mariehamn Mariehamn;1.25
2018-2019;FIN;386;VPS VPS Vaasa VPS;1.0
2018-2019;FIN;387;ROV RoPS Rovaniemi RoPS;1.0
2018-2019;FIN;388;MYP Myllykosken Pallo -47 MYPA;0.5
2018-2019;FIN;389;HNK FC Honka Espoo Honka;0.25
2018-2019;ISL;390;ÍBV ÍBV Vestmannaeyjar ÍBV;1.0
2018-2019;ISL;391;BRE Breidablik Breidablik;0.25
2018-2019;ISL;392;VIK Víkingur Reykjavík Víkingur Reykjavík;0.25
2018-2019;ISL;393;FRA Fram Reykjavík Fram;0.25
2018-2019;BIH;394;TUZ FK Sloboda Tuzla Sloboda;0.25
2018-2019;BIH;394;RAD FK Radnik Bijeljina Radnik Bijeljina;0.25
2018-2019;BIH;396;OLI FK Olimpic Sarajevo Olimpic Sarajevo;0.25
2018-2019;LTU;397;STU FC Stumbras Stumbras;1.0
2018-2019;LTU;398;ATL FK Atlantas Atlantas;1.25
2018-2019;LTU;399;KRU FK Kruoja Kruoja;0.25
2018-2019;LTU;400;EKR FK Ekranas Ekranas;0.25
2018-2019;LTU;400;BAN FK Banga Banga;0.25
2018-2019;NIR;402;COL Coleraine FC Coleraine;1.25
2018-2019;FRO;402;KLA KÍ Klaksvík KÍ;1.25
2018-2019;ARM;402;GAN FC Gandzasar Gandzasar;1.25
2018-2019;KOS;402;PRI FC Prishtina Prishtina;1.25
2018-2019;WAL;406;BAL Bala Town FC Bala;1.25
2018-2019;AND;407;SJU UE Sant Julià Sant Julià;1.25
2018-2019;LUX;408;DIF FC Differdange 03 Differdange;1.25
2018-2019;GEO;409;DIL FC Dila Gori Dila;1.25
2018-2019;LVA;410;RIG Riga FC Riga;1.0
2018-2019;LVA;411;SKO Skonto FC Skonto;0.5
2018-2019;LVA;412;DAU FC Daugava Daugavpils Daugava Daugavpils;0.25
2018-2019;LVA;412;DAR FC Daugava Rīga Daugava Rīga;0.25
2018-2019;LUX;414;RAC Racing FC Union Luxembourg Racing Union;1.0
2018-2019;LUX;415;JEU AS Jeunesse Esch Jeunesse Esch;0.5
2018-2019;ARM;416;ULI Ulisses FC Ulisses;0.25
2018-2019;ARM;417;MIK FC Mika Mika;0.25
2018-2019;MLT;418;GZI Gżira United FC Gżira;1.0
2018-2019;MLT;419;FLO Floriana FC Floriana;0.25
2018-2019;MLT;420;SLI Sliema Wanderers FC Sliema;0.25
2018-2019;SMR;421;TRE SP Tre Fiori Tre Fiori;1.0
2018-2019;EST;421;TRA JK Narva Trans Trans;1.0
2018-2019;AND;421;ENG UE Engordany Engordany;1.0
2018-2019;EST;424;FCI FCI Tallinn FCI;0.75
2018-2019;EST;425;SIL JK Sillamäe Kalev Sillamäe;0.75
2018-2019;EST;426;TAR FC Santos Tartu Santos Tartu;0.25
2018-2019;GEO;427;BAT FC Dinamo Batumi Dinamo Batumi;0.5
2018-2019;GEO;428;FC Tskhinvali Tskhinvali;0.25
2018-2019;GEO;429;ZES FC Zestafoni Zestafoni;0.5
2018-2019;GEO;430;SIO FC Sioni Bolnisi Sioni;0.25
2018-2019;WAL;431;CEF Cefn Druids AFC Cefn Druids;0.5
2018-2019;WAL;432;BAN Bangor City FC Bangor;0.5
2018-2019;MNE;433;ZET FK Zeta Zeta;0.25
2018-2019;WAL;434;LLT Llandudno FC Llandudno;0.25
2018-2019;MNE;434;BOK FK Bokelj Bokelj;0.25
2018-2019;WAL;436;NEW Newtown AFC Newtown;0.5
2018-2019;WAL;437;AUK AUK Broughton FC Broughton;0.5
2018-2019;WAL;438;ABE Aberystwyth Town FC Aberystwyth;0.25
2018-2019;MNE;438;FK Lovćen Lovćen;0.25
2018-2019;MNE;438;FK Čelik Nikšić Čelik Nikšić;0.25
2018-2019;GIB;441;STJ St Joseph's FC St Joseph's;0.75
2018-2019;FRO;442;FUG ÍF Fuglafjørdur ÍF;0.25
2018-2019;NIR;443;BAL Ballymena United FC Ballymena;0.25
2018-2019;NIR;444;GLE Glentoran FC Glentoran;0.25
2018-2019;SMR;445;TRE SP Tre Penne SP Tre Penne;0.75
2018-2019;AND;446;SAN UE Santa Coloma UE Santa Coloma;0.75
2018-2019;KOS;447;TRE KF Trepça’89 Trepça’89;0.5
2018-2019;AND;448;LUS FC Lusitans Lusitans;0.5
2018-2019;SMR;449;JUV AC Juvenes/Dogana Juvenes/Dogana;0.25
2018-2019;SMR;450;LIB AC Libertas Libertas;0.25
2019-2020;GER;1;BAY FC Bayern München Bayern;136.0
2019-2020;ESP;2;RM Real Madrid CF Real Madrid;134.0
2019-2020;ESP;3;BAR FC Barcelona Barcelona;128.0
2019-2020;ESP;4;ATL Club Atlético de Madrid Atlético;127.0
2019-2020;ITA;5;JUV Juventus Juventus;117.0
2019-2020;ENG;6;MC Manchester City FC Man. City;116.0
2019-2020;FRA;7;PAR Paris Saint-Germain Paris;113.0
2019-2020;ESP;8;SEV Sevilla FC Sevilla;102.0
2019-2020;ENG;9;MU Manchester United Man. United;100.0
2019-2020;ENG;10;LIV Liverpool FC Liverpool;99.0
2019-2020;ENG;11;ARS Arsenal FC Arsenal;91.0
2019-2020;UKR;12;SHK FC Shakhtar Donetsk Shakhtar Donetsk;85.0
2019-2020;GER;13;BVB Borussia Dortmund Dortmund;85.0
2019-2020;ENG;14;TOT Tottenham Hotspur Tottenham;85.0
2019-2020;FRA;15;OL Olympique Lyonnais Lyon;83.0
2019-2020;ENG;16;CHE Chelsea FC Chelsea;83.0
2019-2020;ITA;17;ASR AS Roma Roma;80.0
2019-2020;ITA;18;NAP SSC Napoli Napoli;77.0
2019-2020;POR;19;POR FC Porto Porto;75.0
2019-2020;POR;20;SLB SL Benfica Benfica;70.0
2019-2020;NED;21;AJX AFC Ajax Ajax;69.5
2019-2020;RUS;22;ZEN FC Zenit Zenit;64.0
2019-2020;GER;23;BL Bayer 04 Leverkusen Leverkusen;61.0
2019-2020;SUI;24;BSL FC Basel 1893 Basel;58.5
2019-2020;ESP;25;VLR Villarreal CF Villarreal;56.0
2019-2020;UKR;26;DK FC Dynamo Kyiv Dynamo Kyiv;55.0
2019-2020;ESP;27;VAL Valencia CF Valencia;54.0
2019-2020;TUR;28;BJK Beşiktaş JK Beşiktaş;54.0
2019-2020;AUT;29;SBG FC Salzburg Salzburg;53.5
2019-2020;POR;30;SCP Sporting Clube de Portugal Sporting CP;50.0
2019-2020;GER;31;LEI RB Leipzig Leipzig;49.0
2019-2020;GER;32;SCH FC Schalke 04 Schalke;46.0
2019-2020;ITA;33;INT FC Internazionale Milano Inter;44.0
2019-2020;RUS;34;CSM PFC CSKA Moskva CSKA Moskva;44.0
2019-2020;GRE;35;OLY Olympiacos FC Olympiacos;43.0
2019-2020;DEN;36;CPH F.C. Copenhagen Copenhagen;42.0
2019-2020;POR;37;SCB SC Braga Braga;41.0
2019-2020;ITA;38;LAZ SS Lazio Lazio;41.0
2019-2020;FRA;39;MON AS Monaco FC Monaco;41.0
2019-2020;BEL;40;GNT KAA Gent Gent;39.5
2019-2020;NED;41;PSV PSV Eindhoven PSV;37.0
2019-2020;GER;42;WOL VfL Wolfsburg Wolfsburg;36.0
2019-2020;BEL;43;AND RSC Anderlecht Anderlecht;36.0
2019-2020;ESP;44;ATH Athletic Club Athletic Club;36.0
2019-2020;RUS;45;KRA FC Krasnodar Krasnodar;35.5
2019-2020;SCO;46;CEL Celtic FC Celtic;34.0
2019-2020;CZE;47;PLZ FC Viktoria Plzeň Plzeň;34.0
2019-2020;ITA;48;ATA Atalanta BC Atalanta;33.5
2019-2020;CRO;49;DZ GNK Dinamo Zagreb Dinamo Zagreb;33.5
2019-2020;GER;50;EIN Eintracht Frankfurt Frankfurt;33.0
2019-2020;RUS;51;LMO FC Lokomotiv Moskva Lokomotiv Moskva;33.0
2019-2020;TUR;52;FEN Fenerbahçe SK Fenerbahçe;31.5
2019-2020;FRA;53;OM Olympique de Marseille Marseille;31.0
2019-2020;CZE;54;SPP AC Sparta Praha Sparta Praha;30.5
2019-2020;BEL;55;GNK KRC Genk Genk;30.0
2019-2020;KAZ;56;AST FC Astana Astana;29.0
2019-2020;BEL;57;BRU Club Brugge Club Brugge;28.5
2019-2020;CYP;58;APO APOEL FC APOEL;27.5
2019-2020;CZE;59;SLP SK Slavia Praha Slavia Praha;27.5
2019-2020;BUL;60;LUD PFC Ludogorets 1945 Ludogorets;26.0
2019-2020;GER;61;MON VfL Borussia Mönchengladbach Mönchengladbach;26.0
2019-2020;SUI;62;YB BSC Young Boys Young Boys;25.5
2019-2020;BLR;63;BTE FC BATE Borisov BATE;24.0
2019-2020;TUR;64;GAL Galatasaray AŞ Galatasaray;23.5
2019-2020;SRB;65;CRV FK Crvena zvezda Crvena zvezda;22.75
2019-2020;SWE;66;MAL Malmö FF Malmö;22.0
2019-2020;SRB;67;PTZ FK Partizan Partizan;22.0
2019-2020;FRA;68;STE AS Saint-Étienne St-Étienne;22.0
2019-2020;AUT;69;RPD SK Rapid Wien Rapid Wien;22.0
2019-2020;ENG;70;LEI Leicester City FC Leicester;22.0
2019-2020;TUR;71;BFK İstanbul Başakşehir İstanbul Başakşehir;21.5
2019-2020;AZE;72;QAR Qarabağ FK Qarabağ;21.0
2019-2020;GRE;73;PAO PAOK FC PAOK;21.0
2019-2020;BEL;74;STD R. Standard de Liège Standard Liège;20.5
2019-2020;ROU;75;SB FCSB FCSB;20.5
2019-2020;ESP;76;GET Getafe CF Getafe;11.0
2019-2020;ESP;77;ESP RCD Espanyol Espanyol;10.0
2019-2020;ESP;78;BET Real Betis Balompié Betis;10.0
2019-2020;ESP;79;REA Real Sociedad de Fútbol Real Sociedad;9.0
2019-2020;ESP;80;CEL RC Celta de Vigo Celta;19.0
2019-2020;ITA;81;ACM AC Milan Milan;19.0
2019-2020;ITA;82;FIO ACF Fiorentina Fiorentina;19.0
2019-2020;NED;83;AZ AZ Alkmaar AZ Alkmaar;18.5
2019-2020;RUS;84;SPM FC Spartak Moskva Spartak Moskva;18.5
2019-2020;ENG;85;WOL Wolverhampton Wanderers FC Wolves;16.0
2019-2020;ENG;86;BUR Burnley FC Burnley;2.5
2019-2020;ENG;87;EVE Everton FC Everton;3.0
2019-2020;ENG;88;SOU Southampton FC Southampton;7.5
2019-2020;ENG;89;WES West Ham United FC West Ham;2.5
2019-2020;NED;90;FEY Feyenoord Feyenoord;17.0
2019-2020;POL;91;LEG Legia Warszawa Legia;17.0
2019-2020;GRE;92;AEK AEK Athens FC AEK;16.5
2019-2020;ISR;93;MTA Maccabi Tel-Aviv FC M. Tel-Aviv;16.5
2019-2020;SCO;94;RAN Rangers FC Rangers;16.25
2019-2020;NOR;95;MOL Molde FK Molde;15.0
2019-2020;GER;96;HOF TSG 1899 Hoffenheim Hoffenheim;11.0
2019-2020;GER;97;HER Hertha BSC Berlin Hertha;5.0
2019-2020;GER;98;KÖL 1. FC Köln Köln;4.0
2019-2020;GER;99;FRE SC Freiburg Freiburg;1.0
2019-2020;GER;100;MAI 1. FSV Mainz 05 Mainz;7.0
2019-2020;GER;101;AUG FC Augsburg Augsburg;7.0
2019-2020;DEN;102;MID FC Midtjylland Midtjylland;14.5
2019-2020;ITA;103;TOR Torino FC Torino;2.5
2019-2020;ITA;104;US Sassuolo Calcio Sassuolo;4.0
2019-2020;ITA;105;SAM UC Sampdoria Sampdoria;1.0
2019-2020;AUT;106;LAS LASK LASK;14.0
2019-2020;FRA;107;REN Stade Rennais FC Rennes;14.0
2019-2020;SVN;108;MBR NK Maribor Maribor;14.0
2019-2020;ISR;109;HAP Hapoel Beer-Sheva FC H. Beer-Sheva;14.0
2019-2020;NOR;110;RBK Rosenborg BK Rosenborg;13.5
2019-2020;SUI;111;FCZ FC Zürich Zürich;13.0
2019-2020;MDA;112;SHF FC Sheriff Tiraspol Sheriff;12.75
2019-2020;ROU;113;CFR CFR 1907 Cluj CFR Cluj;12.5
2019-2020;CYP;114;APO Apollon Limassol FC Apollon;12.5
2019-2020;UKR;115;ZOR FC Zorya Luhansk Zorya Luhansk;12.5
2019-2020;RUS;116;ROS FC Rostov Rostov;12.0
2019-2020;FRA;117;LIL LOSC Lille LOSC;6.0
2019-2020;FRA;118;STR Racing Club de Strasbourg Alsace Strasbourg;2.5
2019-2020;FRA;119;BOR FC Girondins de Bordeaux Bordeaux;10.0
2019-2020;FRA;120;NIC OGC Nice Nice;10.0
2019-2020;CRO;121;RIJ HNK Rijeka Rijeka;11.0
2019-2020;HUN;122;FEH Fehérvár FC Fehérvár;10.5
2019-2020;CYP;123;LAR AEK Larnaca FC AEK Larnaca;10.0
2019-2020;AUT;124;AUS FK Austria Wien Austria Wien;10.0
2019-2020;SWE;125;Östersunds FK Östersund;10.0
2019-2020;POR;126;GUI Vitória SC Vitória SC;9.0
2019-2020;POR;127;RIO Rio Ave FC Rio Ave;2.5
2019-2020;POR;128;MRT CS Marítimo Marítimo;1.5
2019-2020;POR;129;FC Arouca Arouca;1.5
2019-2020;POR;130;BEL Os Belenenses Belenenses;4.0
2019-2020;ROU;131;AST FC Astra Giurgiu Astra;9.5
2019-2020;RUS;132;TUL FC Arsenal Tula Arsenal Tula;1.5
2019-2020;RUS;133;UFA FC Ufa Ufa;2.5
2019-2020;RUS;134;RUB FC Rubin Rubin;5.0
2019-2020;HUN;135;FER Ferencvárosi TC Ferencváros;9.0
2019-2020;SUI;136;LUG FC Lugano Lugano;9.0
2019-2020;SUI;137;SIO FC Sion Sion;9.0
2019-2020;DEN;138;BIF Brøndby IF Brøndby;8.5
2019-2020;IRL;139;DUN Dundalk FC Dundalk;8.5
2019-2020;SVK;140;TRN FC Spartak Trnava Spartak Trnava;8.5
2019-2020;LUX;141;DUD F91 Diddeleng Diddeleng;8.25
2019-2020;TUR;142;ANK Osmanlıspor Osmanlıspor;8.0
2019-2020;CZE;143;LIB FC Slovan Liberec Liberec;8.0
2019-2020;BEL;144;ANT Royal Antwerp FC Antwerp;2.5
2019-2020;BEL;145;ZUL SV Zulte Waregem Zulte Waregem;5.0
2019-2020;BEL;146;OOS KV Oostende Oostende;1.0
2019-2020;BEL;147;CHA R. Charleroi SC Charleroi;1.0
2019-2020;AZE;148;GAB Gabala SC Gabala;7.5
2019-2020;CRO;149;HAJ HNK Hajduk Split Hajduk Split;7.5
2019-2020;MKD;150;SHK KF Shkëndija Shkëndija;7.25
2019-2020;UKR;151;OLE FC Olexandriya Olexandriya;5.5
2019-2020;UKR;152;ILL FC Mariupol Mariupol;4.0
2019-2020;UKR;153;VOR FC Vorskla Poltava Vorskla;5.0
2019-2020;UKR;154;ODO FC Olimpik Donetsk Olimpik Donetsk;1.0
2019-2020;UKR;155;DNI FC Dnipro Dnipro;5.0
2019-2020;NED;156;UTR FC Utrecht Utrecht;3.0
2019-2020;NED;157;VIT Vitesse Vitesse;7.0
2019-2020;NED;158;HER Heracles Almelo Heracles;1.0
2019-2020;NED;159;GRO FC Groningen Groningen;2.0
2019-2020;NED;160;GOA Go Ahead Eagles Go Ahead Eagles;0.25
2019-2020;SVK;161;SVB ŠK Slovan Bratislava Slovan Bratislava;7.0
2019-2020;SWE;162;AIK AIK AIK;7.0
2019-2020;WAL;163;TNS The New Saints FC TNS;7.0
2019-2020;FIN;164;HJK HJK Helsinki HJK;7.0
2019-2020;CZE;165;JAB FK Jablonec Jablonec;7.0
2019-2020;BLR;166;MIN FC Dinamo Minsk Dinamo Minsk;7.0
2019-2020;POL;167;LEC KKS Lech Poznań Lech;7.0
2019-2020;TUR;168;KON Konyaspor Konyaspor;7.0
2019-2020;LTU;169;SUD FK Sūduva Sūduva;6.75
2019-2020;TUR;170;TRA Trabzonspor AŞ Trabzonspor;4.0
2019-2020;TUR;171;YMA Yeni Malatyaspor Yeni Malatyaspor;2.0
2019-2020;TUR;172;AKH Akhisar Belediyespor Akhisar;3.0
2019-2020;AUT;173;WAC Wolfsberger AC Wolfsberg;5.0
2019-2020;AUT;174;STM SK Sturm Graz Sturm;5.5
2019-2020;AUT;175;ADM FC Admira Wacker Mödling Admira;2.5
2019-2020;AUT;176;ALT SCR Altach Altach;3.0
2019-2020;SCO;177;ABE Aberdeen FC Aberdeen;6.5
2019-2020;BIH;178;ZRI HŠK Zrinjski Zrinjski;6.25
2019-2020;ARM;179;ALA Alashkert FC Alashkert;6.0
2019-2020;KAZ;180;KAI FC Kairat Almaty Kairat;6.0
2019-2020;LTU;181;ZAL FK Žalgiris Vilnius Žalgiris;6.0
2019-2020;ALB;182;SKË KF Skënderbeu Skënderbeu;6.0
2019-2020;DEN;183;ESB Esbjerg fB Esbjerg;1.5
2019-2020;DEN;184;NRS FC Nordsjælland Nordsjælland;2.0
2019-2020;DEN;185;LYN Lyngby BK Lyngby;1.0
2019-2020;DEN;186;SON SønderjyskE SønderjyskE;1.5
2019-2020;DEN;187;RAN Randers FC Randers;0.5
2019-2020;SVN;188;DOM NK Domžale Domžale;5.75
2019-2020;SCO;189;KIL Kilmarnock FC Kilmarnock;1.0
2019-2020;SCO;190;HIB Hibernian FC Hibernian;2.5
2019-2020;SCO;191;STJ St Johnstone FC St Johnstone;0.5
2019-2020;SCO;192;HEA Heart of Midlothian FC Hearts;0.5
2019-2020;SCO;193;INV Inverness Caledonian Thistle FC Inverness;0.5
2019-2020;SUI;194;LUZ FC Luzern Luzern;5.5
2019-2020;ARM;195;PYU FC Pyunik Pyunik;5.5
2019-2020;LIE;196;VAD FC Vaduz Vaduz;5.5
2019-2020;ROU;197;VII FC Viitorul Viitorul;5.5
2019-2020;ALB;198;KUK FK Kukësi Kukës;5.5
2019-2020;SVK;199;TRE AS Trenčín Trenčín;5.5
2019-2020;CZE;200;MLA FK Mladá Boleslav Mladá Boleslav;4.5
2019-2020;CZE;201;SIG SK Sigma Olomouc Sigma;2.5
2019-2020;CZE;202;ZLI FC Zlín Zlín;2.0
2019-2020;CYP;203;AEL AEL Limassol FC AEL;2.5
2019-2020;CYP;204;ANO Anorthosis Famagusta FC Anorthosis;1.0
2019-2020;CYP;205;OMO Omonoia FC Omonoia;1.5
2019-2020;SUI;206;THU FC Thun Thun;3.5
2019-2020;SUI;207;STG FC St. Gallen St. Gallen;1.5
2019-2020;SUI;208;GCZ Grasshopper Club Zürich Grasshoppers;1.5
2019-2020;GRE;209;ATR Atromitos FC Atromitos;5.0
2019-2020;GRE;210;ARI Aris Thessaloniki FC Aris;2.0
2019-2020;GRE;211;AST Asteras Tripolis FC Asteras;4.5
2019-2020;GRE;212;PAN Panathinaikos FC Panathinaikos;5.0
2019-2020;GRE;213;PAN Panionios GSS Panionios;1.0
2019-2020;GRE;214;GIA PAS Giannina FC Giannina;1.0
2019-2020;MLT;215;VAL Valletta FC Valletta;5.25
2019-2020;LVA;216;VEN FK Ventspils Ventspils;5.25
2019-2020;SVN;217;OLI NK Olimpija Ljubljana Olimpija Ljubljana;5.25
2019-2020;NIR;218;CRU Crusaders FC Crusaders;5.25
2019-2020;GIB;218;LRI Lincoln Red Imps FC Lincoln Red Imps;5.25
2019-2020;SRB;220;CUK FK Čukarički Čukarički;2.5
2019-2020;SRB;221;RAD FK Radnicki Niš Radnicki Niš;2.5
2019-2020;SRB;222;SUB FK Spartak Subotica Spartak Subotica;2.0
2019-2020;SRB;223;VOJ FK Vojvodina Vojvodina;3.25
2019-2020;SRB;224;LUC FK Mladost Lučani Mladost Lučani;0.25
2019-2020;ROU;225;CRA Universitatea Craiova Universitatea Craiova;5.0
2019-2020;EST;226;KAL Nõmme Kalju FC Kalju;5.0
2019-2020;MKD;227;VAR FK Vardar Vardar;5.0
2019-2020;CRO;228;OSI NK Osijek Osijek;4.5
2019-2020;CRO;229;LOK NK Lokomotiva Zagreb Lokomotiva Zagreb;2.0
2019-2020;BLR;230;SHA FC Shakhtyor Soligorsk Shakhtyor;4.75
2019-2020;BIH;231;SAR FK Sarajevo Sarajevo;4.75
2019-2020;GEO;232;DIN FC Dinamo Tbilisi Dinamo Tbilisi;4.75
2019-2020;IRL;233;COR Cork City FC Cork;4.75
2019-2020;LUX;234;FOL CS Fola Esch Fola;4.75
2019-2020;SWE;235;NOR IFK Norrköping FK Norrköping;3.5
2019-2020;SWE;236;HÄC BK Häcken Häcken;3.5
2019-2020;SWE;237;DJU Djurgårdens IF Djurgården;1.5
2019-2020;SWE;238;IFK IFK Göteborg Göteborg;2.5
2019-2020;SWE;239;ELF IF Elfsborg Elfsborg;1.0
2019-2020;AND;240;SAN FC Santa Coloma FC Santa Coloma;4.5
2019-2020;ALB;241;PAR FK Partizani Partizani;4.5
2019-2020;ISL;242;HAF FH Hafnarfjördur FH;4.5
2019-2020;NOR;243;HAU FK Haugesund Haugesund;2.5
2019-2020;NOR;244;BRA SK Brann Brann;1.5
2019-2020;NOR;245;SAR Sarpsborg 08 FF Sarpsborg;4.0
2019-2020;NOR;246;LIL Lillestrøm SK Lillestrøm;1.5
2019-2020;NOR;247;ODD Odds BK Odd;3.0
2019-2020;NOR;248;STR Strømsgodset IF Strømsgodset;1.5
2019-2020;NOR;249;STA Stabæk Fotball Stabæk;0.25
2019-2020;NIR;250;LIN Linfield FC Linfield;4.25
2019-2020;ISL;251;VAL Valur Valur;4.25
2019-2020;LUX;252;PRO FC Progrès Niederkorn Progrès;4.25
2019-2020;ISL;253;STJ Stjarnan Stjarnan;4.25
2019-2020;MNE;254;POD FK Budućnost Podgorica Budućnost Podgorica;4.25
2019-2020;LTU;255;RIT FK Riteriai Riteriai;4.25
2019-2020;BUL;256;SOF PFC CSKA-Sofia CSKA-Sofia;4.0
2019-2020;MNE;257;SUT FK Sutjeska Sutjeska;4.0
2019-2020;HUN;258;HON Budapest Honvéd FC Honvéd;4.0
2019-2020;EST;259;FLO FC Flora Tallinn Flora;4.0
2019-2020;LVA;260;LIE FK Liepāja Liepāja;4.0
2019-2020;MNE;261;TGD OFK Titograd Titograd;4.0
2019-2020;ISR;262;BNE Bnei Yehuda Tel-Aviv FC Bnei Yehuda;3.5
2019-2020;ISR;263;MHA Maccabi Haifa FC M. Haifa;2.0
2019-2020;ISR;264;HAP Hapoel Haifa FC H. Haifa;2.0
2019-2020;ISR;265;JER Beitar Jerusalem FC Beitar Jerusalem;3.5
2019-2020;ISR;266;HAP Hapoel Kiryat Shmona FC H. Kiryat Shmona;1.0
2019-2020;KAZ;267;ORD FC Ordabasy Shymkent Ordabasy;2.25
2019-2020;KAZ;268;TOB FC Tobol Kostanay Tobol;2.5
2019-2020;KAZ;269;IRT FC Irtysh Pavlodar Irtysh;1.5
2019-2020;KAZ;270;AKT FC Aktobe Aktobe;0.5
2019-2020;BLR;271;VIT FC Vitebsk Vitebsk;1.0
2019-2020;BLR;272;BRE FC Dinamo Brest Dinamo Brest;2.5
2019-2020;BLR;273;ZHO FC Torpedo Zhodino Torpedo Zhodino;1.25
2019-2020;AZE;274;NEF Neftçi PFK Neftçi;3.75
2019-2020;IRL;275;SHA Shamrock Rovers FC Shamrock Rovers;3.75
2019-2020;GEO;276;KUT FC Torpedo Kutaisi Torpedo Kutaisi;3.75
2019-2020;FRO;277;B36 B36 Tórshavn B36;3.75
2019-2020;MDA;278;FC Milsami Orhei Milsami;3.75
2019-2020;AZE;279;SAB Sabail Sabail;1.0
2019-2020;LVA;280;SPA FK Spartaks Jūrmala Spartaks Jūrmala;3.75
2019-2020;AZE;281;KES Keşla FK Keşla;2.5
2019-2020;AZE;282;ZIR Zirä FK Zirä FK;0.5
2019-2020;AZE;283;KAP Käpäz PFK Käpäz;0.5
2019-2020;LVA;284;RIG Riga FC Riga;3.5
2019-2020;GEO;285;CHI FC Chikhura Sachkhere Chikhura;3.5
2019-2020;BUL;286;LS PFC Levski Sofia Levski;3.5
2019-2020;BUL;287;LOK PFC Lokomotiv Plovdiv 1926 Lokomotiv Plovdiv;2.0
2019-2020;BUL;288;SLA PFC Slavia Sofia Slavia Sofia;1.75
2019-2020;BUL;289;BOT PFC Botev Plovdiv Botev Plovdiv;1.0
2019-2020;BUL;290;DUN FC Dunav Ruse Dunav;0.25
2019-2020;BUL;291;BER PFC Beroe Stara Zagora Beroe;1.0
2019-2020;BUL;292;CMV PFC Cherno More AD Cherno More;0.5
2019-2020;BUL;293;LTX PFC Litex Lovech Litex;0.25
2019-2020;ROU;294;DB FC Dinamo Bucureşti Dinamo Bucureşti;1.0
2019-2020;ROU;295;PAN CS Pandurii Târgu Jiu Pandurii;1.0
2019-2020;ROU;296;CSMS laşi CSMS laşi;0.5
2019-2020;ROU;297;ASA Târgu Mureş Târgu Mureş;1.0
2019-2020;ROU;298;BOT FC Botoşani Botoşani;0.5
2019-2020;POL;299;PIA Piast Gliwice Piast;2.0
2019-2020;POL;300;LEC KS Lechia Gdańsk Lechia;1.5
2019-2020;POL;301;CRA MKS Cracovia Kraków Cracovia;1.25
2019-2020;POL;302;JAG Jagiellonia Białystok Jagiellonia;3.0
2019-2020;POL;303;GOR Górnik Zabrze Górnik Zabrze;1.5
2019-2020;POL;304;ARK Arka Gdynia Arka;1.0
2019-2020;POL;305;ZAG Zagłębie Lubin Zagłębie;1.0
2019-2020;POL;306;SLA WKS Śląsk Wrocław Śląsk;0.5
2019-2020;WAL;307;CON Connah's Quay Nomads FC Connah's Quay;3.25
2019-2020;MLT;308;BAL Balzan FC Balzan;3.25
2019-2020;EST;309;LT FC Levadia Tallinn Levadia;3.25
2019-2020;MLT;310;HIB Hibernians FC Hibernians;3.25
2019-2020;MKD;311;RAB FK Rabotnicki Rabotnicki;3.25
2019-2020;SVK;312;DAC FC DAC 1904 Dunajská Streda Dunajská Streda;3.0
2019-2020;SVK;313;RUZ MFK Ružomberok Ružomberok;2.0
2019-2020;SVK;314;ZIL MŠK Žilina Žilina;2.5
2019-2020;SVK;315;TJ Spartak Myjava Spartak Myjava;0.25
2019-2020;HUN;316;DEB Debreceni VSC Debrecen;3.0
2019-2020;SMR;317;LAF La Fiorita 1967 La Fiorita;3.0
2019-2020;FRO;318;VIK Víkingur Vikingur;3.0
2019-2020;BIH;319;ŽEL FK Željezničar Željezničar;3.0
2019-2020;FRO;320;KLA KÍ Klaksvík KÍ;2.75
2019-2020;ALB;321;LAC KF Laçi Laç;2.75
2019-2020;BIH;322;ŠIR NK Široki Brijeg Široki Brijeg;2.75
2019-2020;GIB;323;CEU Europa FC Europa;2.75
2019-2020;SVN;324;MUR NŠ Mura Mura;1.0
2019-2020;SVN;325;RUD NK Rudar Velenje Rudar Velenje;1.5
2019-2020;SVN;326;GOR ND Gorica Gorica;0.75
2019-2020;SVN;327;KOP FC Koper Koper;0.5
2019-2020;SVN;328;CJE NK Celje Celje;0.25
2019-2020;HUN;329;UJP Újpest FC Újpest;1.5
2019-2020;HUN;330;VAS Vasas FC Vasas;0.25
2019-2020;HUN;331;MTK MTK Budapest MTK;0.75
2019-2020;ARM;332;ARA Ararat-Armenia FC Ararat-Armenia;2.5
2019-2020;FIN;333;KUP KuPS Kuopio KuPS;2.5
2019-2020;MLT;333;GZI Gżira United FC Gżira;2.5
2019-2020;NIR;335;CLI Cliftonville FC Cliftonville;2.5
2019-2020;ISL;336;REY KR Reykjavík KR Reykjavik;2.5
2019-2020;SMR;337;TRE SP Tre Penne SP Tre Penne;2.25
2019-2020;ARM;338;URA FC Urartu Urartu;2.25
2019-2020;FRO;339;NSÍ NSÍ Runavík NSÍ;2.25
2019-2020;GEO;340;SAM FC Samtredia Samtredia;2.25
2019-2020;MNE;341;RUD FK Rudar Pljevlja Rudar Pljevlja;2.25
2019-2020;GEO;342;SAB FC Saburtalo Saburtalo;2.0
2019-2020;FRO;343;HB HB Tórshavn HB;2.0
2019-2020;MDA;344;PET Petrocub-Hincesti Petrocub;2.0
2019-2020;EST;344;TRA JK Narva Trans Trans;2.0
2019-2020;MKD;344;SHK FC Shkupi 1927 Shkupi;2.0
2019-2020;AND;344;ENG UE Engordany Engordany;2.0
2019-2020;MLT;348;BIR Birkirkara FC Birkirkara;2.0
2019-2020;LUX;349;JEU AS Jeunesse Esch Jeunesse Esch;1.75
2019-2020;GIB;350;STJ St Joseph's FC St Joseph's;1.75
2019-2020;IRL;351;STP Saint Patrick's Athletic FC St Patrick's;1.75
2019-2020;KOS;352;PRI FC Prishtina Prishtina;1.75
2019-2020;MDA;353;FC Zaria Balti Zaria Balti;1.75
2019-2020;LVA;354;JEL FK Jelgava Jelgava;1.75
2019-2020;LUX;355;RAC Racing FC Union Luxembourg Racing Union;1.0
2019-2020;LUX;356;DIF FC Differdange 03 Differdange;1.0
2019-2020;LTU;357;KAU FK Kauno Žalgiris Kauno Žalgiris;1.0
2019-2020;LTU;358;STU FC Stumbras Stumbras;1.0
2019-2020;LTU;359;ATL FK Atlantas Atlantas;0.75
2019-2020;LTU;360;KRU FK Kruoja Kruoja;0.25
2019-2020;LVA;361;RFS RFS RFS;1.0
2019-2020;ARM;362;GAN FC Gandzasar Gandzasar;1.25
2019-2020;ARM;363;SHI FC Shirak Shirak;1.25
2019-2020;LVA;364;SKO Skonto FC Skonto;0.5
2019-2020;ARM;365;ULI Ulisses FC Ulisses;0.25
2019-2020;KOS;366;FER KF Feronikeli Feronikeli;1.5
2019-2020;FIN;367;ROV RoPS Rovaniemi RoPS;1.5
2019-2020;SMR;368;TRE SP Tre Fiori Tre Fiori;1.5
2019-2020;AND;369;SJU UE Sant Julià Sant Julià;1.5
2019-2020;KOS;370;DRI FC Drita Drita;1.5
2019-2020;NIR;371;GLE Glenavon FC Glenavon;1.5
2019-2020;SMR;372;FOL SS Folgore Folgore;1.5
2019-2020;FIN;373;SJK SJK Seinäjoki SJK;1.5
2019-2020;ALB;374;TEU KF Teuta Teuta;1.25
2019-2020;MKD;375;PAN Akademija Pandev Akademija Pandev;1.0
2019-2020;MKD;375;MAK FK Makedonija GP Skopje Makedonija;1.0
2019-2020;ALB;377;LUF KS Luftëtari Luftëtari;1.0
2019-2020;ALB;378;TIR KF Tirana Tirana;0.25
2019-2020;MKD;378;PEL FK Pelister Pelister;0.25
2019-2020;MKD;380;SIL FK Sileks Sileks;0.25
2019-2020;MKD;381;REN KF Renova Renova;0.25
2019-2020;BIH;382;RAD FK Radnik Bijeljina Radnik Bijeljina;1.25
2019-2020;BIH;383;TUZ FK Sloboda Tuzla Sloboda;0.25
2019-2020;BIH;384;OLI FK Olimpic Sarajevo Olimpic Sarajevo;0.25
2019-2020;MDA;385;SPE FC Speranța Nisporeni Speranța Nisporeni;1.0
2019-2020;MDA;386;DAC FC Dacia Chisinau Dacia;1.0
2019-2020;MDA;387;ZIM FC Zimbru Chisinau Zimbru;0.5
2019-2020;MDA;388;SAX FC Saxan Saxan;0.25
2019-2020;IRL;389;DER Derry City FC Derry;1.25
2019-2020;IRL;390;UCD University College Dublin AFC UCD;0.5
2019-2020;FIN;391;TUR FC Inter Turku Inter Turku;1.0
2019-2020;FIN;392;LAH FC Lahti Lahti;1.25
2019-2020;FIN;393;ILV Ilves Tampere Ilves;1.0
2019-2020;FIN;394;MAR IFK Mariehamn Mariehamn;1.25
2019-2020;FIN;395;VPS VPS Vaasa VPS;0.75
2019-2020;NIR;396;BAL Ballymena United FC Ballymena;1.25
2019-2020;MNE;396;ZET FK Zeta Zeta;1.25
2019-2020;ISL;398;BRE Breidablik Breidablik;1.25
2019-2020;NIR;399;COL Coleraine FC Coleraine;1.25
2019-2020;WAL;400;BAL Bala Town FC Bala;1.25
2014-2015;ITA;14;JUV Juventus Juventus;81.0
2014-2015;RUS;15;ZEN FC Zenit Zenit;80.0
2014-2015;GER;16;BL Bayer 04 Leverkusen Leverkusen;72.0
2014-2015;ENG;17;MC Manchester City FC Man. City;71.0
2014-2015;UKR;18;SHK FC Shakhtar Donetsk Shakhtar Donetsk;77.0
2014-2015;SUI;19;BSL FC Basel 1893 Basel;78.0
2014-2015;ITA;20;NAP SSC Napoli Napoli;70.0
2014-2015;ENG;21;TOT Tottenham Hotspur Tottenham;68.0
2014-2015;ITA;22;ACM AC Milan Milan;69.0
2014-2015;ESP;23;SEV Sevilla FC Sevilla;60.5
2014-2015;ITA;24;INT FC Internazionale Milano Inter;63.0
2014-2015;FRA;25;OL Olympique Lyonnais Lyon;62.5
2014-2015;NED;26;AJX AFC Ajax Ajax;58.0
2014-2015;UKR;27;DK FC Dynamo Kyiv Dynamo Kyiv;56.0
2014-2015;GRE;28;OLY Olympiacos FC Olympiacos;56.0
2014-2015;ESP;29;VLR Villarreal CF Villarreal;39.0
2014-2015;NED;30;PSV PSV Eindhoven PSV;50.0
2014-2015;RUS;31;RUB FC Rubin Rubin;47.0
2014-2015;ESP;32;ATH Athletic Club Athletic Club;37.0
2014-2015;POR;33;SCP Sporting Clube de Portugal Sporting CP;44.0
2014-2015;RUS;34;CSM PFC CSKA Moskva CSKA Moskva;45.5
2014-2015;FRA;35;OM Olympique de Marseille Marseille;45.0
2014-2015;UKR;36;DNI FC Dnipro Dnipro;43.0
2014-2015;POR;37;SCB SC Braga Braga;39.5
