season;federation;position;club;points
2021-2022;TUR;188;SIV Sivasspor Sivasspor;6.5
2021-2022;SUI;189;LUZ FC Luzern Luzern;6.5
2021-2022;SVN;190;DOM NK Domžale Domžale;6.5
2021-2022;BLR;191;BRE FC Dinamo Brest Dinamo Brest;6.5
2021-2022;GEO;192;DIN FC Dinamo Tbilisi Dinamo Tbilisi;6.5
2021-2022;SVK;193;DAC FC DAC 1904 Dunajská Streda Dunajská Streda;6.5
2021-2022;LIE;194;VAD FC Vaduz Vaduz;6.5
2021-2022;UKR;195;Kolos Kovalivka Kolos Kovalivka;4.0
2021-2022;UKR;196;VOR FC Vorskla Poltava Vorskla;4.5
2021-2022;UKR;197;FC Desna Chernihiv Desna;2.0
2021-2022;UKR;198;OLE FC Olexandriya Olexandriya;4.5
2021-2022;UKR;199;ILL FC Mariupol Mariupol;4.0
2021-2022;UKR;200;ODO FC Olimpik Donetsk Olimpik Donetsk;1.0
2021-2022;MNE;201;SUT FK Sutjeska Sutjeska;6.25
2021-2022;BLR;201;SHA FC Shakhtyor Soligorsk Shakhtyor;6.25
2021-2022;FRO;203;KLA KÍ Klaksvík KÍ;6.25
2021-2022;BEL;204;CHA R. Charleroi SC Charleroi;2.5
2021-2022;BEL;205;ZUL SV Zulte Waregem Zulte Waregem;5.0
2021-2022;BEL;206;OOS KV Oostende Oostende;1.0
2021-2022;ALB;207;LAC KF Laçi Laç;6.0
2021-2022;POL;208;LEC KKS Lech Poznań Lech;6.0
2021-2022;SUI;209;SER Servette FC Servette;3.0
2021-2022;SUI;210;STG FC St. Gallen St. Gallen;3.5
2021-2022;SUI;211;THU FC Thun Thun;2.0
2021-2022;SUI;212;SIO FC Sion Sion;1.0
2021-2022;WAL;213;CON Connah's Quay Nomads FC Connah's Quay;5.75
2021-2022;SVN;214;MUR NŠ Mura Mura;5.5
2021-2022;TUR;215;TRA Trabzonspor AŞ Trabzonspor;5.5
2021-2022;BUL;216;LOK PFC Lokomotiv Plovdiv 1926 Lokomotiv Plovdiv;5.5
2021-2022;MLT;217;HIB Hibernians FC Hibernians;5.5
2021-2022;ISL;218;HAF FH Hafnarfjördur FH;5.5
2021-2022;AND;219;SAN FC Santa Coloma FC Santa Coloma;5.5
2021-2022;ISL;220;VAL Valur Valur;5.5
2021-2022;LUX;221;PRO FC Progrès Niederkorn Progrès;5.5
2021-2022;HUN;222;HON Budapest Honvéd FC Honvéd;5.5
2021-2022;ALB;223;KUK FK Kukësi Kukës;5.5
2021-2022;GRE;224;ARI Aris Thessaloniki FC Aris;5.0
2021-2022;CZE;225;SLO 1. FC Slovácko Slovácko;1.5
2021-2022;CZE;226;LIB FC Slovan Liberec Liberec;5.0
2021-2022;GRE;227;OFI OFI Crete FC OFI;1.5
2021-2022;GRE;228;ATR Atromitos FC Atromitos;3.5
2021-2022;CZE;229;MLA FK Mladá Boleslav Mladá Boleslav;3.0
2021-2022;CZE;230;SIG SK Sigma Olomouc Sigma;2.5
2021-2022;GRE;231;AST Asteras Tripolis FC Asteras;1.5
2021-2022;CZE;232;ZLI FC Zlín Zlín;2.0
2021-2022;GRE;233;PAN Panathinaikos FC Panathinaikos;1.5
2021-2022;GRE;234;PAN Panionios GSS Panionios;1.0
2021-2022;CRO;235;LOK NK Lokomotiva Zagreb Lokomotiva Zagreb;2.0
2021-2022;DEN;236;AGF AGF Aarhus AGF;3.0
2021-2022;DEN;237;SON SønderjyskE SønderjyskE;2.0
2021-2022;DEN;238;ESB Esbjerg fB Esbjerg;1.5
2021-2022;DEN;239;NRS FC Nordsjælland Nordsjælland;2.0
2021-2022;DEN;240;LYN Lyngby BK Lyngby;1.0
2021-2022;TUR;241;ALA Alanyaspor Alanyaspor;2.0
2021-2022;TUR;242;YMA Yeni Malatyaspor Yeni Malatyaspor;2.0
2021-2022;TUR;243;AKH Akhisar Belediyespor Akhisar;3.0
2021-2022;TUR;244;KON Konyaspor Konyaspor;5.0
2021-2022;CYP;245;AEL AEL Limassol FC AEL;4.5
2021-2022;LVA;246;VEN FK Ventspils Ventspils;5.25
2021-2022;NOR;247;VÅL Vålerenga Fotball Vålerenga;1.5
2021-2022;NOR;248;VIK Viking FK Viking;1.5
2021-2022;NOR;249;HAU FK Haugesund Haugesund;2.5
2021-2022;NOR;250;BRA SK Brann Brann;1.5
2021-2022;NOR;251;SAR Sarpsborg 08 FF Sarpsborg;4.0
2021-2022;NOR;252;LIL Lillestrøm SK Lillestrøm;1.5
2021-2022;NOR;253;ODD Odds BK Odd;1.0
2021-2022;KOS;254;DRI FC Drita Drita;5.0
2021-2022;ARM;255;ARA Ararat-Armenia FC Ararat-Armenia;5.0
2021-2022;LTU;256;RIT FK Riteriai Riteriai;5.0
2021-2022;MLT;257;VAL Valletta FC Valletta;5.0
2021-2022;BLR;258;MIN FC Dinamo Minsk Dinamo Minsk;5.0
2021-2022;SWE;259;AIK AIK AIK;5.0
2021-2022;ISR;260;ASH FC Ashdod Ashdod;1.5
2021-2022;ISR;261;JER Beitar Jerusalem FC Beitar Jerusalem;2.5
2021-2022;ISR;262;BNE Bnei Yehuda Tel-Aviv FC Bnei Yehuda;3.5
2021-2022;ISR;263;HAP Hapoel Haifa FC H. Haifa;2.0
2021-2022;EST;264;LT FC Levadia Tallinn Levadia;4.75
2021-2022;FRO;265;B36 B36 Tórshavn B36;4.75
2021-2022;SWE;266;HAM Hammarby Fotboll Hammarby;4.0
2021-2022;SWE;267;ELF IF Elfsborg Elfsborg;2.5
2021-2022;SWE;268;HÄC BK Häcken Häcken;4.5
2021-2022;SWE;269;DJU Djurgårdens IF Djurgården;3.5
2021-2022;SWE;270;IFK IFK Göteborg Göteborg;1.5
2021-2022;SWE;271;NOR IFK Norrköping FK Norrköping;2.5
2021-2022;SVK;272;ZIL MŠK Žilina Žilina;4.5
2021-2022;ALB;273;TEU KF Teuta Teuta;4.5
2021-2022;KAZ;274;TOB FC Tobol Kostanay Tobol;4.5
2021-2022;MDA;275;PET Petrocub-Hincesti Petrocub;4.5
2021-2022;MKD;275;SHK FC Shkupi 1927 Shkupi;4.5
2021-2022;LVA;277;LIE FK Liepāja Liepāja;4.5
2021-2022;GIB;278;CEU Europa FC Europa;4.5
2021-2022;EST;279;KAL Nõmme Kalju FC Kalju;4.5
2021-2022;ROU;280;VII FC Viitorul Viitorul;4.5
2021-2022;KOS;281;PRI FC Prishtina Prishtina;4.25
2021-2022;ALB;282;PAR FK Partizani Partizani;4.25
2021-2022;ISL;283;STJ Stjarnan Stjarnan;4.25
2021-2022;ARM;284;PYU FC Pyunik Pyunik;4.25
2021-2022;ISL;285;BRE Breidablik Breidablik;4.0
2021-2022;LVA;285;RFS RFS RFS;4.0
2021-2022;FRO;287;HB HB Tórshavn HB;4.0
2021-2022;AZE;288;KES Keşla FK Keşla;4.0
2021-2022;MLT;289;GZI Gżira United FC Gżira;4.0
2021-2022;SMR;290;LAF La Fiorita 1967 La Fiorita;4.0
2021-2022;ALB;291;SKË KF Skënderbeu Skënderbeu;4.0
2021-2022;BUL;292;Arda PFC Arda;1.5
2021-2022;BUL;293;SLA PFC Slavia Sofia Slavia Sofia;2.5
2021-2022;BUL;294;LS PFC Levski Sofia Levski;3.0
2021-2022;BUL;295;BOT PFC Botev Plovdiv Botev Plovdiv;1.0
2021-2022;BUL;296;DUN FC Dunav Ruse Dunav;0.25
2021-2022;MDA;297;FC Milsami Orhei Milsami;3.75
2021-2022;NIR;298;COL Coleraine FC Coleraine;3.75
2021-2022;FRO;299;NSÍ NSÍ Runavík NSÍ;3.75
2021-2022;GEO;300;KUT FC Torpedo Kutaisi Torpedo Kutaisi;3.75
2021-2022;HUN;301;UJP Újpest FC Újpest;3.5
2021-2022;LTU;302;KAU FK Kauno Žalgiris Kauno Žalgiris;3.5
2021-2022;BIH;303;ŠIR NK Široki Brijeg Široki Brijeg;3.5
2021-2022;POL;304;PIA Piast Gliwice Piast;3.5
2021-2022;AZE;305;GAB Gabala SC Gabala;3.5
2021-2022;IRL;306;COR Cork City FC Cork;3.5
2021-2022;ROU;307;SEP Sepsi Sfantu Gheorghe Sepsi Sfantu Gheorghe;1.5
2021-2022;ROU;308;BOT FC Botoşani Botoşani;1.5
2021-2022;ROU;309;DB FC Dinamo Bucureşti Dinamo Bucureşti;1.0
2021-2022;ROU;309;AST FC Astra Giurgiu Astra;1.0
2021-2022;AZE;311;SUM Sumqayıt FK Sumqayıt;2.5
2021-2022;AZE;312;SAB Sabail Sabail;1.0
2021-2022;AZE;313;ZIR Zirä FK Zirä FK;0.5
2021-2022;HUN;314;PUS Puskás Akadémia FC Puskás Akadémia;2.5
2021-2022;HUN;315;DEB Debreceni VSC Debrecen;1.5
2021-2022;HUN;316;VAS Vasas FC Vasas;0.25
2021-2022;GEO;317;BAT FC Dinamo Batumi Dinamo Batumi;3.25
2021-2022;WAL;318;BAL Bala Town FC Bala;3.25
2021-2022;SMR;319;TRE SP Tre Penne SP Tre Penne;3.25
2021-2022;GIB;320;STJ St Joseph's FC St Joseph's;3.25
2021-2022;GEO;321;CHI FC Chikhura Sachkhere Chikhura;3.25
2021-2022;NIR;321;CRU Crusaders FC Crusaders;3.25
2021-2022;POL;323;RAK Raków Czestochowa Raków;2.5
2021-2022;POL;324;SLA WKS Śląsk Wrocław Śląsk;2.0
2021-2022;POL;325;POG MKS Pogoń Szczecin Pogoń;1.5
2021-2022;POL;326;CRA MKS Cracovia Kraków Cracovia;2.0
2021-2022;POL;327;LEC KS Lechia Gdańsk Lechia;1.5
2021-2022;POL;328;JAG Jagiellonia Białystok Jagiellonia;2.5
2021-2022;POL;329;GOR Górnik Zabrze Górnik Zabrze;1.5
2021-2022;POL;330;ARK Arka Gdynia Arka;1.0
2021-2022;KAZ;331;KAR FC Shakhter Karagandy Shakhter;2.5
2021-2022;KAZ;332;KAI FC Kaysar Kyzylorda Kaysar;1.5
2021-2022;KAZ;333;ORD FC Ordabasy Shymkent Ordabasy;2.75
2021-2022;KAZ;334;IRT FC Irtysh Pavlodar Irtysh;1.5
2021-2022;SVK;335;RUZ MFK Ružomberok Ružomberok;3.0
2021-2022;SVK;336;TRE AS Trenčín Trenčín;3.0
2021-2022;IRL;337;BOH Bohemian FC Bohemians;3.0
2021-2022;BIH;338;BAN FK Borac Banja Luka Borac;3.0
2021-2022;AND;338;INT Inter Club d'Escaldes Inter Escaldes;3.0
2021-2022;FIN;340;TUR FC Inter Turku Inter Turku;3.0
2021-2022;ARM;341;URA FC Urartu Urartu;3.0
2021-2022;SVN;342;CJE NK Celje Celje;2.0
2021-2022;ISL;343;REY KR Reykjavík KR Reykjavik;3.0
2021-2022;SMR;344;TRE SP Tre Fiori Tre Fiori;3.0
2021-2022;GEO;345;SAB FC Saburtalo Saburtalo;3.0
2021-2022;BIH;346;ŽEL FK Željezničar Željezničar;3.0
2021-2022;LVA;347;SPA FK Spartaks Jūrmala Spartaks Jūrmala;3.0
2021-2022;SVN;348;RUD NK Rudar Velenje Rudar Velenje;1.5
2021-2022;MKD;349;VAR FK Vardar Vardar;3.0
2021-2022;SVN;350;GOR ND Gorica Gorica;0.5
2021-2022;ALB;351;TIR KF Tirana Tirana;2.75
2021-2022;MLT;352;BAL Balzan FC Balzan;2.75
2021-2022;FIN;353;HNK FC Honka Espoo Honka;2.5
2021-2022;BLR;354;ZHO FC Torpedo Zhodino Torpedo Zhodino;1.5
2021-2022;MDA;355;SFI FC Sfintul Gheorghe FCSG;2.5
2021-2022;MKD;355;SIL FK Sileks Sileks;2.5
2021-2022;AND;357;ENG UE Engordany Engordany;2.5
2021-2022;MNE;358;TGD OFK Titograd Titograd;2.5
2021-2022;BLR;359;VIT FC Vitebsk Vitebsk;1.0
2021-2022;FRO;360;VIK Víkingur Vikingur;2.5
2021-2022;SMR;361;FOL SS Folgore Folgore;2.25
2021-2022;AND;362;SJU UE Sant Julià Sant Julià;2.25
2021-2022;MLT;363;FLO Floriana FC Floriana;2.25
2021-2022;MNE;364;ZET FK Zeta Zeta;2.25
2021-2022;IRL;365;DER Derry City FC Derry;2.25
2021-2022;MDA;366;DAU FC Dinamo-Auto Tiraspol Dinamo-Auto;1.0
2021-2022;MDA;367;SPE FC Speranța Nisporeni Speranța Nisporeni;1.0
2021-2022;MDA;368;FC Zaria Balti Zaria Balti;1.5
2021-2022;MDA;369;DAC FC Dacia Chisinau Dacia;0.25
2021-2022;NIR;370;LAR Larne FC Larne;2.0
2021-2022;BIH;370;VEL FK Velež Velež;2.0
2021-2022;MLT;372;BIR Birkirkara FC Birkirkara;2.0
2021-2022;LTU;373;Panevezys Panevezys;1.5
2021-2022;NIR;374;GLE Glentoran FC Glentoran;2.0
2021-2022;LVA;374;FK Valmiera Valmiera;2.0
2021-2022;EST;374;PAI Paide Linnameeskond Paide;2.0
2021-2022;ARM;374;FC Noah FC Noah;2.0
2021-2022;LUX;378;RAC Racing FC Union Luxembourg Racing Union;2.0
2021-2022;GEO;379;LOK FC Locomotive Tbilisi Locomotive Tbilisi;2.0
2021-2022;FIN;380;ILV Ilves Tampere Ilves;2.0
2021-2022;NIR;381;CLI Cliftonville FC Cliftonville;2.0
2021-2022;EST;381;TRA JK Narva Trans Trans;2.0
2021-2022;GEO;383;SAM FC Samtredia Samtredia;2.0
2021-2022;LTU;384;STU FC Stumbras Stumbras;1.0
2021-2022;LTU;385;ATL FK Atlantas Atlantas;0.25
2021-2022;BIH;386;RAD FK Radnik Bijeljina Radnik Bijeljina;1.0
2021-2022;FIN;387;ROV RoPS Rovaniemi RoPS;1.0
2021-2022;FIN;388;LAH FC Lahti Lahti;1.0
2021-2022;FIN;389;MAR IFK Mariehamn Mariehamn;1.0
2021-2022;FIN;390;VPS VPS Vaasa VPS;0.5
2021-2022;FIN;391;SJK SJK Seinäjoki SJK;0.25
2021-2022;LUX;392;HES FC Swift Hesper Swift;1.0
2021-2022;LUX;393;DIF FC Differdange 03 Differdange;1.25
2021-2022;LUX;394;Union Titus Petange Union Titus Petange;1.0
2021-2022;LUX;395;JEU AS Jeunesse Esch Jeunesse Esch;1.5
2021-2022;LVA;396;JEL FK Jelgava Jelgava;0.25
2021-2022;KOS;397;LLA KF Llapi Llapi;1.0
2021-2022;KOS;398;GJI KF Gjilani Gjilani;1.0
2021-2022;KOS;399;FER KF Feronikeli Feronikeli;1.5
2021-2022;KOS;400;TRE KF Trepça’89 Trepça’89;0.5
2021-2022;ARM;401;ARA FC Ararat Ararat;1.5
2021-2022;IRL;402;SLI Sligo Rovers FC Sligo;1.0
2021-2022;ARM;403;SHI FC Shirak Shirak;1.25
2021-2022;IRL;404;STP Saint Patrick's Athletic FC St Patrick's;1.0
2021-2022;ARM;405;GAN FC Gandzasar Gandzasar;1.25
2021-2022;NIR;406;BAL Ballymena United FC Ballymena;1.25
2021-2022;NIR;407;GLE Glenavon FC Glenavon;1.0
2021-2022;ALB;408;VLL KF Vllaznia Vllaznia;1.5
2021-2022;ALB;409;LUF KS Luftëtari Luftëtari;1.0
2021-2022;MKD;410;REN KF Renova Renova;1.5
2021-2022;MKD;411;RAB FK Rabotnicki Rabotnicki;1.5
2021-2022;EST;412;FCI FCI Tallinn FCI;0.5
2021-2022;GEO;413;FC Gagra Gagra;1.0
2021-2022;MKD;413;FC Struga FC Struga;1.0
2021-2022;MLT;413;MOS Mosta FC Mosta;1.0
2021-2022;GEO;413;DIL FC Dila Gori Dila;1.0
2021-2022;MLT;417;SIR FC Sirens Sirens;1.0
2021-2022;MKD;418;MAK FK Makedonija GP Skopje Makedonija;1.0
2021-2022;MKD;418;PAN Akademija Pandev Akademija Pandev;1.0
2021-2022;MKD;420;PEL FK Pelister Pelister;0.25
2021-2022;WAL;421;NEW Newtown AFC Newtown;1.0
2021-2022;WAL;422;BAR Barry Town AFC Barry;1.0
2021-2022;WAL;423;INT Cardiff Metropolitan University FC Cardiff Met;0.5
2021-2022;WAL;424;CEF Cefn Druids AFC Cefn Druids;0.5
2021-2022;WAL;425;BAN Bangor City FC Bangor;0.25
2021-2022;GIB;426;MON Mons Calpe SC Mons Calpe;1.0
2021-2022;ISL;427;VIK Víkingur Reykjavík Víkingur Reykjavík;1.0
2021-2022;ISL;428;ÍBV ÍBV Vestmannaeyjar ÍBV;1.0
2021-2022;MNE;429;DEC FK Dečić Dečić;1.0
2021-2022;MNE;429;FK Podgorica FK Podgorica;1.0
2021-2022;MNE;431;ISK FK Iskra Iskra;1.0
2021-2022;MNE;432;RUD FK Rudar Pljevlja Rudar Pljevlja;1.0
2021-2022;AND;433;SAN UE Santa Coloma UE Santa Coloma;0.25
2017-2018;MNE;412;FK Lovćen Lovćen;0.25
2017-2018;FRO;414;EBS EB/Streymur EB/Streymur;1.0
2017-2018;ARM;415;GAN FC Gandzasar Gandzasar;0.5
2017-2018;ARM;416;URA FC Urartu Urartu;0.75
2017-2018;ARM;417;ULI Ulisses FC Ulisses;0.25
2017-2018;ARM;418;MIK FC Mika Mika;0.5
2017-2018;MLT;419;BAL Balzan FC Balzan;0.75
2017-2018;MLT;420;FLO Floriana FC Floriana;0.25
2017-2018;MLT;421;SLI Sliema Wanderers FC Sliema;0.5
2017-2018;LUX;422;PRO FC Progrès Niederkorn Progrès;0.75
2017-2018;NIR;423;COL Coleraine FC Coleraine;0.25
2017-2018;NIR;423;BAL Ballymena United FC Ballymena;0.25
2017-2018;NIR;425;GLE Glenavon FC Glenavon;0.75
2017-2018;NIR;426;GLE Glentoran FC Glentoran;0.5
2017-2018;WAL;427;CON Connah's Quay Nomads FC Connah's Quay;0.75
2017-2018;WAL;428;BAN Bangor City FC Bangor;0.5
2017-2018;WAL;429;LLT Llandudno FC Llandudno;0.25
2017-2018;WAL;430;NEW Newtown AFC Newtown;0.5
2016-2017;GER;7;BVB Borussia Dortmund Dortmund;109.0
2016-2017;ESP;8;SEV Sevilla FC Sevilla;92.0
2016-2017;POR;9;SLB SL Benfica Benfica;102.0
2016-2017;ENG;10;CHE Chelsea FC Chelsea;91.0
2016-2017;ENG;11;ARS Arsenal FC Arsenal;90.0
2016-2017;ENG;12;MC Manchester City FC Man. City;85.0
2016-2017;POR;13;POR FC Porto Porto;89.0
2016-2017;GER;14;SCH FC Schalke 04 Schalke;81.0
2016-2017;ENG;15;MU Manchester United Man. United;80.0
2016-2017;GER;16;BL Bayer 04 Leverkusen Leverkusen;75.0
2016-2017;ITA;17;NAP SSC Napoli Napoli;74.0
2016-2017;UKR;18;SHK FC Shakhtar Donetsk Shakhtar Donetsk;79.0
2016-2017;RUS;19;ZEN FC Zenit Zenit;77.0
2016-2017;ENG;20;TOT Tottenham Hotspur Tottenham;62.0
2016-2017;ESP;21;VAL Valencia CF Valencia;55.0
2016-2017;SUI;22;BSL FC Basel 1893 Basel;68.0
2016-2017;FRA;23;OL Olympique Lyonnais Lyon;57.5
2016-2017;ITA;24;FIO ACF Fiorentina Fiorentina;54.0
2016-2017;UKR;25;DK FC Dynamo Kyiv Dynamo Kyiv;59.0
2016-2017;NED;26;AJX AFC Ajax Ajax;61.0
2016-2017;ESP;27;VLR Villarreal CF Villarreal;44.0
2016-2017;GRE;28;OLY Olympiacos FC Olympiacos;59.0
2016-2017;FRA;29;MON AS Monaco FC Monaco;51.0
2016-2017;ESP;30;ATH Athletic Club Athletic Club;40.0
2016-2017;TUR;31;GAL Galatasaray AŞ Galatasaray;51.0
2016-2017;BEL;32;AND RSC Anderlecht Anderlecht;50.0
2016-2017;ITA;33;LAZ SS Lazio Lazio;42.0
2016-2017;ENG;34;LIV Liverpool FC Liverpool;41.0
2016-2017;GER;35;WOL VfL Wolfsburg Wolfsburg;40.0
2016-2017;GER;36;MON VfL Borussia Mönchengladbach Mönchengladbach;38.0
2016-2017;ITA;37;ASR AS Roma Roma;39.0
2016-2017;UKR;38;DNI FC Dnipro Dnipro;45.0
2016-2017;TUR;39;FEN Fenerbahçe SK Fenerbahçe;44.0
2016-2017;CZE;40;SPP AC Sparta Praha Sparta Praha;41.5
2016-2017;ITA;41;ACM AC Milan Milan;33.0
2016-2017;NED;42;PSV PSV Eindhoven PSV;40.0
2016-2017;TUR;43;BJK Beşiktaş JK Beşiktaş;38.0
2016-2017;BEL;44;GNK KRC Genk Genk;37.0
2016-2017;ITA;45;INT FC Internazionale Milano Inter;30.0
2016-2017;RUS;46;RUB FC Rubin Rubin;34.0
2016-2017;ESP;47;MAL Málaga CF Málaga;22.0
2016-2017;SCO;48;CEL Celtic FC Celtic;39.0
2016-2017;CZE;49;PLZ FC Viktoria Plzeň Plzeň;34.0
2016-2017;AUT;50;SBG FC Salzburg Salzburg;35.5
2016-2017;ESP;51;CEL RC Celta de Vigo Celta;19.0
2016-2017;RUS;52;CSM PFC CSKA Moskva CSKA Moskva;29.5
2016-2017;BEL;53;BRU Club Brugge Club Brugge;31.0
2016-2017;DEN;54;CPH F.C. Copenhagen Copenhagen;33.0
2016-2017;POR;55;SCB SC Braga Braga;27.5
2016-2017;ENG;56;LEI Leicester City FC Leicester;22.0
2016-2017;POR;57;SCP Sporting Clube de Portugal Sporting CP;27.0
2016-2017;FRA;58;STE AS Saint-Étienne St-Étienne;24.5
2016-2017;BEL;59;GNT KAA Gent Gent;27.0
2016-2017;ROU;60;SB FCSB FCSB;30.5
2016-2017;GRE;61;PAO PAOK FC PAOK;29.5
2016-2017;BUL;62;LUD PFC Ludogorets 1945 Ludogorets;31.0
2016-2017;ESP;63;LEV Levante UD Levante;13.0
2016-2017;ESP;64;BET Real Betis Balompié Betis;12.0
2016-2017;NED;65;AZ AZ Alkmaar AZ Alkmaar;26.5
2016-2017;RUS;66;KRA FC Krasnodar Krasnodar;22.0
2016-2017;RUS;67;ANJ FC Anji Anji;21.0
2016-2017;ENG;68;NEW Newcastle United FC Newcastle;15.0
2016-2017;BLR;69;BTE FC BATE Borisov BATE;25.5
2016-2017;FRA;70;BOR FC Girondins de Bordeaux Bordeaux;18.0
2016-2017;ENG;71;EVE Everton FC Everton;14.0
2016-2017;SUI;72;YB BSC Young Boys Young Boys;22.5
2016-2017;AUT;73;RPD SK Rapid Wien Rapid Wien;23.5
2016-2017;POL;74;LEG Legia Warszawa Legia;24.5
2016-2017;FRA;75;OM Olympique de Marseille Marseille;17.0
2016-2017;GER;76;EIN Eintracht Frankfurt Frankfurt;12.0
2016-2017;ITA;77;TOR Torino FC Torino;13.0
2016-2017;RUS;78;DM FC Dynamo Moscow Dynamo Moscow;17.5
2016-2017;ESP;79;REA Real Sociedad de Fútbol Real Sociedad;6.5
2016-2017;TUR;80;TRA Trabzonspor AŞ Trabzonspor;19.5
2016-2017;GER;81;STU VfB Stuttgart Stuttgart;10.5
2016-2017;CYP;82;APO APOEL FC APOEL;22.5
2016-2017;CRO;83;DZ GNK Dinamo Zagreb Dinamo Zagreb;21.0
2016-2017;GER;84;HAN Hannover 96 Hannover;10.0
2016-2017;CZE;85;LIB FC Slovan Liberec Liberec;18.5
2016-2017;GER;86;MAI 1. FSV Mainz 05 Mainz;8.0
2016-2017;RUS;87;ROS FC Rostov Rostov;13.5
2016-2017;ISR;88;MTA Maccabi Tel-Aviv FC M. Tel-Aviv;19.5
2016-2017;NED;89;FEY Feyenoord Feyenoord;17.0
2016-2017;GER;90;AUG FC Augsburg Augsburg;7.0
2016-2017;ENG;91;SOU Southampton FC Southampton;7.5
2016-2017;FRA;92;LIL LOSC Lille LOSC;11.0
2016-2017;ENG;93;SWA Swansea City AFC Swansea;7.0
2016-2017;SVN;94;MBR NK Maribor Maribor;18.5
2016-2017;BEL;95;STD R. Standard de Liège Standard Liège;12.5
2016-2017;GER;96;FRE SC Freiburg Freiburg;5.0
2016-2017;RUS;97;LMO FC Lokomotiv Moskva Lokomotiv Moskva;10.5
2016-2017;UKR;98;MET FC Metalist Kharkiv Metalist;12.0
2016-2017;FRA;99;GUI EA Guingamp Guingamp;9.0
2016-2017;NOR;100;MOL Molde FK Molde;16.5
2016-2017;ENG;101;WIG Wigan Athletic FC Wigan;4.0
2016-2017;ITA;102;UDI Udinese Calcio Udinese;4.5
2016-2017;ITA;103;US Sassuolo Calcio Sassuolo;4.0
2016-2017;RUS;104;SPM FC Spartak Moskva Spartak Moskva;8.5
2016-2017;SUI;105;FCZ FC Zürich Zürich;12.0
2016-2017;AZE;106;QAR Qarabağ FK Qarabağ;14.5
2016-2017;ROU;107;AST FC Astra Giurgiu Astra;13.0
2016-2017;ENG;108;WES West Ham United FC West Ham;2.5
2016-2017;UKR;109;CHO FC Chornomorets Odesa Chornomorets Odesa;9.0
2016-2017;FRA;110;MON Montpellier Hérault SC Montpellier;6.0
2016-2017;AUT;111;AUS FK Austria Wien Austria Wien;12.0
2016-2017;BEL;112;LOK KSC Lokeren OV Lokeren;8.5
2016-2017;SWE;113;MAL Malmö FF Malmö;13.0
2016-2017;GER;114;HER Hertha BSC Berlin Hertha;1.0
2016-2017;ROU;115;CFR CFR 1907 Cluj CFR Cluj;12.0
2016-2017;POR;116;EST Estoril Praia Estoril;7.0
2016-2017;FRA;117;NIC OGC Nice Nice;5.5
2016-2017;KAZ;118;AST FC Astana Astana;13.75
2016-2017;ENG;119;Hull City AFC Hull;1.5
2016-2017;DEN;120;MID FC Midtjylland Midtjylland;11.5
2016-2017;SRB;121;PTZ FK Partizan Partizan;13.0
2016-2017;TUR;122;ANK Osmanlıspor Osmanlıspor;8.0
2016-2017;ITA;123;SAM UC Sampdoria Sampdoria;1.0
2016-2017;GRE;124;AST Asteras Tripolis FC Asteras;10.0
2016-2017;CRO;125;RIJ HNK Rijeka Rijeka;10.5
2016-2017;RUS;126;KUB FC Kuban Krasnodar Kuban;5.0
2016-2017;GRE;127;PAN Panathinaikos FC Panathinaikos;9.5
2016-2017;POR;128;GUI Vitória SC Vitória SC;5.0
2016-2017;POR;129;MRT CS Marítimo Marítimo;5.0
2016-2017;DEN;130;ESB Esbjerg fB Esbjerg;10.0
2016-2017;BEL;131;ZUL SV Zulte Waregem Zulte Waregem;6.0
2016-2017;SUI;132;SIO FC Sion Sion;8.0
2016-2017;POR;133;RIO Rio Ave FC Rio Ave;4.0
2016-2017;POR;134;BEL Os Belenenses Belenenses;4.0
2016-2017;POR;135;COI A. Académica de Coimbra Académica;4.0
2016-2017;UKR;136;ZOR FC Zorya Luhansk Zorya Luhansk;5.0
2016-2017;POR;137;PAÇ FC Paços de Ferreira Paços Ferreira;3.0
2016-2017;NOR;138;RBK Rosenborg BK Rosenborg;9.0
2016-2017;NED;139;TWE FC Twente Twente;5.5
2016-2017;CRO;140;HAJ HNK Hajduk Split Hajduk Split;6.5
2016-2017;POR;141;FC Arouca Arouca;1.5
2016-2017;POR;142;NCL CD Nacional Nacional;1.5
2016-2017;DEN;143;AAL Aalborg BK AaB;6.5
2016-2017;DEN;144;NRS FC Nordsjælland Nordsjælland;6.5
2016-2017;MDA;145;SHF FC Sheriff Tiraspol Sheriff;9.25
2016-2017;GRE;146;ATR Atromitos FC Atromitos;5.5
2016-2017;BLR;147;MIN FC Dinamo Minsk Dinamo Minsk;7.0
2016-2017;POL;148;LEC KKS Lech Poznań Lech;7.0
2016-2017;SUI;149;GCZ Grasshopper Club Zürich Grasshoppers;4.5
2016-2017;ISR;150;HAP Hapoel Beer-Sheva FC H. Beer-Sheva;7.0
2016-2017;TUR;151;BUR Bursaspor Bursaspor;3.0
2016-2017;CYP;152;APO Apollon Limassol FC Apollon;7.0
2016-2017;FIN;153;HJK HJK Helsinki HJK;9.0
2016-2017;UKR;154;VOR FC Vorskla Poltava Vorskla;2.0
2016-2017;UKR;155;MET FC Metalurh Donetsk Metalurh Donetsk;2.0
2016-2017;SWE;156;ELF IF Elfsborg Elfsborg;6.5
2016-2017;SUI;157;STG FC St. Gallen St. Gallen;4.0
2016-2017;TUR;158;BFK İstanbul Başakşehir İstanbul Başakşehir;2.5
2016-2017;CZE;159;MLA FK Mladá Boleslav Mladá Boleslav;3.5
2016-2017;SWE;160;AIK AIK AIK;6.0
2016-2017;SUI;161;THU FC Thun Thun;3.5
2016-2017;TUR;162;KON Konyaspor Konyaspor;2.0
2016-2017;AZE;163;NEF Neftçi PFK Neftçi;6.25
2016-2017;CZE;164;JAB FK Jablonec Jablonec;3.0
2016-2017;UKR;165;OLE FC Olexandriya Olexandriya;1.0
2016-2017;UKR;166;ARS FC Arsenal Kyiv Arsenal Kyiv;1.0
2016-2017;BEL;167;CHA R. Charleroi SC Charleroi;1.0
2016-2017;SUI;168;LUZ FC Luzern Luzern;3.0
2016-2017;TUR;169;KAR Kardemir Karabükspor Karabükspor;1.5
2016-2017;NED;170;VIT Vitesse Vitesse;3.0
2016-2017;SRB;171;VOJ FK Vojvodina Vojvodina;6.0
2016-2017;TUR;172;ESK Eskişehirspor Eskişehirspor;1.0
2016-2017;DEN;173;BIF Brøndby IF Brøndby;4.0
2016-2017;NED;174;GRO FC Groningen Groningen;2.5
2016-2017;HUN;175;FEH Fehérvár FC Fehérvár;6.75
2016-2017;ISR;176;MHA Maccabi Haifa FC M. Haifa;4.5
2016-2017;ISR;177;HTA Hapoel Tel-Aviv FC H. Tel-Aviv;4.5
2016-2017;CYP;178;OMO Omonoia FC Omonoia;4.5
2016-2017;CYP;179;AEL AEL Limassol FC AEL;4.5
2016-2017;CZE;180;SLP SK Slavia Praha Slavia Praha;1.5
2016-2017;SWE;181;IFK IFK Göteborg Göteborg;4.0
2016-2017;ISR;182;HAP Hapoel Kiryat Shmona FC H. Kiryat Shmona;4.0
2016-2017;ROU;183;PAN CS Pandurii Târgu Jiu Pandurii;3.0
2016-2017;ROU;184;PET FC Petrolul Ploieşti Petrolul;3.0
2016-2017;AZE;185;GAB Gabala SC Gabala;4.25
2016-2017;NED;186;ZWO PEC Zwolle Zwolle;1.5
2016-2017;NED;187;HVN sc Heerenveen Heerenveen;1.5
2016-2017;NOR;188;TRO Tromsø IL Tromsø;4.0
2016-2017;CRO;189;LOK NK Lokomotiva Zagreb Lokomotiva Zagreb;2.5
2016-2017;KAZ;190;AKT FC Aktobe Aktobe;4.5
2016-2017;BLR;191;SHA FC Shakhtyor Soligorsk Shakhtyor;3.5
2016-2017;POL;192;SLA WKS Śląsk Wrocław Śląsk;3.5
2016-2017;SUI;193;SER Servette FC Servette;1.0
2016-2017;SVK;194;SVB ŠK Slovan Bratislava Slovan Bratislava;5.0
2016-2017;SRB;195;CRV FK Crvena zvezda Crvena zvezda;4.25
2016-2017;NED;196;HER Heracles Almelo Heracles;1.0
2016-2017;NOR;197;STR Strømsgodset IF Strømsgodset;3.5
2016-2017;AUT;198;ADM FC Admira Wacker Mödling Admira;2.0
2016-2017;KAZ;199;KAR FC Shakhter Karagandy Shakhter;4.0
2016-2017;SWE;200;HEL Helsingborgs IF Helsingborg;3.0
2016-2017;HUN;201;DEB Debreceni VSC Debrecen;5.0
2016-2017;SVK;202;TRE AS Trenčín Trenčín;4.5
2016-2017;SVK;203;TRN FC Spartak Trnava Spartak Trnava;4.5
2016-2017;ALB;204;SKË KF Skënderbeu Skënderbeu;5.5
2016-2017;SCO;205;ABE Aberdeen FC Aberdeen;3.0
2016-2017;SCO;206;MOT Motherwell FC Motherwell;3.0
2016-2017;NED;207;UTR FC Utrecht Utrecht;0.5
2016-2017;GRE;208;GIA PAS Giannina FC Giannina;1.0
2016-2017;GRE;208;AEK AEK Athens FC AEK;1.0
2016-2017;GRE;210;XAN Xanthi FC Xanthi;1.0
2016-2017;AUT;211;ALT SCR Altach Altach;1.5
2016-2017;AUT;212;STM SK Sturm Graz Sturm;1.5
2016-2017;AUT;213;FC Pasching Pasching;1.5
2016-2017;CRO;214;RNK Split Split;1.5
2016-2017;SCO;215;STJ St Johnstone FC St Johnstone;2.75
2016-2017;NED;216;GOA Go Ahead Eagles Go Ahead Eagles;0.25
2016-2017;POL;217;RUC Ruch Chorzów Ruch;2.5
2016-2017;ROU;218;VSL FC Vaslui Vaslui;1.5
2016-2017;ROU;218;DB FC Dinamo Bucureşti Dinamo Bucureşti;1.5
2016-2017;DEN;220;SON SønderjyskE SønderjyskE;1.5
2016-2017;DEN;221;RAN Randers FC Randers;1.5
2016-2017;DEN;222;HOR AC Horsens Horsens;1.5
2016-2017;CYP;223;LAR AEK Larnaca FC AEK Larnaca;2.5
2016-2017;ISL;224;HAF FH Hafnarfjördur FH;4.5
2016-2017;AUT;225;WAC Wolfsberger AC Wolfsberg;1.0
2016-2017;AUT;226;SV Grödig Grödig;1.0
2016-2017;AUT;226;POL SKN St Pölten St Pölten;1.0
2016-2017;AUT;228;RIE SV Ried Ried;1.0
2016-2017;AZE;229;KES Keşla FK Keşla;2.5
2016-2017;CRO;230;SLA NK Slaven Koprivnica Slaven Koprivnica;1.0
2016-2017;ISR;231;JER Beitar Jerusalem FC Beitar Jerusalem;2.0
2016-2017;ROU;232;VII FC Viitorul Viitorul;1.0
2016-2017;ROU;233;ASA Târgu Mureş Târgu Mureş;1.0
2016-2017;ROU;234;RAP FC Rapid Bucureşti Rapid Bucureşti;1.0
2016-2017;SVK;235;ZIL MŠK Žilina Žilina;3.5
2016-2017;LTU;236;ZAL FK Žalgiris Vilnius Žalgiris;5.0
2016-2017;IRL;237;DUN Dundalk FC Dundalk;4.5
2016-2017;SCO;238;HEA Heart of Midlothian FC Hearts;2.0
2016-2017;WAL;239;TNS The New Saints FC TNS;5.0
2016-2017;LVA;240;VEN FK Ventspils Ventspils;4.5
2016-2017;NOR;241;ODD Odds BK Odd;2.0
2016-2017;KAZ;242;KAI FC Kairat Almaty Kairat;2.5
2016-2017;CRO;243;OSI NK Osijek Osijek;0.5
2016-2017;GEO;244;DIN FC Dinamo Tbilisi Dinamo Tbilisi;4.25
2016-2017;GEO;245;DIL FC Dila Gori Dila;4.25
2016-2017;BLR;246;MIN FC Minsk Minsk;1.5
2016-2017;SWE;247;HÄC BK Häcken Häcken;1.5
2016-2017;ROU;248;CSMS laşi CSMS laşi;0.5
2016-2017;ROU;249;BOT FC Botoşani Botoşani;0.5
2016-2017;BIH;250;SAR FK Sarajevo Sarajevo;4.0
2016-2017;DEN;251;AGF AGF Aarhus AGF;0.5
2016-2017;BLR;252;ZHO FC Torpedo Zhodino Torpedo Zhodino;1.25
2016-2017;CYP;253;ANO Anorthosis Famagusta FC Anorthosis;1.5
2016-2017;ISL;254;REY KR Reykjavík KR Reykjavik;3.5
2016-2017;MKD;255;VAR FK Vardar Vardar;4.0
2016-2017;LUX;256;DUD F91 Diddeleng Diddeleng;4.0
2016-2017;BLR;257;GOM FC Gomel Gomel;1.0
2016-2017;POL;258;ZAG Zagłębie Lubin Zagłębie;1.0
