season;federation;position;club;points
2015-2016;MDA;291;DAC FC Dacia Chisinau Dacia;2.5
2015-2016;BLR;292;ZHO FC Torpedo Zhodino Torpedo Zhodino;0.25
2015-2016;ISL;293;STJ Stjarnan Stjarnan;2.5
2015-2016;ISR;294;JER Beitar Jerusalem FC Beitar Jerusalem;0.5
2015-2016;ISR;295;MAC Maccabi Netanya FC M. Netanya;0.5
2015-2016;DEN;296;AGF AGF Aarhus AGF;0.5
2015-2016;MKD;297;VAR FK Vardar Vardar;3.0
2015-2016;SRB;298;FK Jagodina Jagodina;1.25
2015-2016;BUL;299;BOT PFC Botev Plovdiv Botev Plovdiv;1.5
2015-2016;SVN;300;MUR ND Mura 05 Mura;1.5
2015-2016;NOR;301;STA Stabæk Fotball Stabæk;0.25
2015-2016;IRL;302;SLI Sligo Rovers FC Sligo;3.0
2015-2016;ALB;303;KUK FK Kukësi Kukës;2.75
2015-2016;SCO;304;INV Inverness Caledonian Thistle FC Inverness;0.5
2015-2016;SCO;305;HIB Hibernian FC Hibernian;0.5
2015-2016;SRB;306;CUK FK Čukarički Čukarički;1.0
2015-2016;SVN;307;KOP FC Koper Koper;1.25
2015-2016;EST;308;LT FC Levadia Tallinn Levadia;3.0
2015-2016;EST;309;KAL Nõmme Kalju FC Kalju;3.0
2015-2016;ARM;310;PYU FC Pyunik Pyunik;3.0
2015-2016;MDA;311;ZIM FC Zimbru Chisinau Zimbru;2.0
2015-2016;KAZ;312;IRT FC Irtysh Pavlodar Irtysh;1.0
2015-2016;KAZ;313;TOB FC Tobol Kostanay Tobol;1.0
2015-2016;ISL;314;BRE Breidablik Breidablik;2.0
2015-2016;BIH;315;ŠIR NK Široki Brijeg Široki Brijeg;2.25
2015-2016;BUL;316;BER PFC Beroe Stara Zagora Beroe;1.0
2015-2016;SVN;317;DOM NK Domžale Domžale;1.0
2015-2016;BUL;318;LOK FC Lokomotiv Sofia 1929 Lokomotiv Sofia;1.0
2015-2016;KAZ;319;ORD FC Ordabasy Shymkent Ordabasy;0.75
2015-2016;LVA;320;SKO Skonto FC Skonto;2.5
2015-2016;LUX;321;FOL CS Fola Esch Fola;2.5
2015-2016;HUN;322;FER Ferencvárosi TC Ferencváros;1.5
2015-2016;HUN;323;ETO Győri ETO FC Győr;1.5
2015-2016;MKD;324;MET FK Metalurg Skopje Metalurg Skopje;2.25
2015-2016;SRB;325;RAD FK Rad Rad;0.5
2015-2016;NIR;326;CRU Crusaders FC Crusaders;2.5
2015-2016;NIR;327;CLI Cliftonville FC Cliftonville;2.5
2015-2016;SVN;328;CJE NK Celje Celje;0.75
2015-2016;EST;329;FLO FC Flora Tallinn Flora;2.5
2015-2016;MNE;330;RUD FK Rudar Pljevlja Rudar Pljevlja;2.25
2015-2016;MNE;331;SUT FK Sutjeska Sutjeska;2.25
2015-2016;FRO;332;HB HB Tórshavn HB;2.5
2015-2016;AZE;333;BAK Bakı FK Bakı;0.25
2015-2016;AZE;334;OLI Olimpik-Şüvälan PFK Olimpik-Şüvälan;0.25
2015-2016;BIH;335;ZRI HŠK Zrinjski Zrinjski;1.75
2015-2016;BUL;336;CMV PFC Cherno More AD Cherno More;0.5
2015-2016;SVN;337;GOR ND Gorica Gorica;0.5
2015-2016;GEO;338;CHI FC Chikhura Sachkhere Chikhura;1.5
2015-2016;GEO;339;OLI FC Metalurgi Rustavi Metalurgi Rustavi;1.5
2015-2016;BUL;340;LOK PFC Lokomotiv Plovdiv 1926 Lokomotiv Plovdiv;0.5
2015-2016;ARM;341;SHI FC Shirak Shirak;2.25
2015-2016;KAZ;342;ZHE FC Zhetysu Taldykorgan Zhetysu;0.25
2015-2016;FIN;343;KUP KuPS Kuopio KuPS;1.5
2015-2016;MNE;344;POD FK Budućnost Podgorica Budućnost Podgorica;2.0
2015-2016;HUN;345;DIÓ Diósgyőri VTK Diósgyőr;1.0
2015-2016;HUN;346;HON Budapest Honvéd FC Honvéd;1.0
2015-2016;HUN;347;PAK Paksi FC Paks;1.0
2015-2016;MLT;348;BIR Birkirkara FC Birkirkara;2.25
2015-2016;MKD;349;SHK KF Shkëndija Shkëndija;1.75
2015-2016;SVK;350;KOS MFK Košice Košice;0.5
2015-2016;SVN;351;RUD NK Rudar Velenje Rudar Velenje;0.25
2015-2016;LVA;352;DAU FC Daugava Daugavpils Daugava Daugavpils;1.75
2015-2016;ISL;353;ÍBV ÍBV Vestmannaeyjar ÍBV;1.0
2015-2016;FIN;354;HNK FC Honka Espoo Honka;1.25
2015-2016;FRO;355;VIK Víkingur Vikingur;2.0
2015-2016;MNE;356;ZET FK Zeta Zeta;1.75
2015-2016;AND;357;SAN FC Santa Coloma FC Santa Coloma;2.5
2015-2016;BIH;358;BAN FK Borac Banja Luka Borac;1.25
2015-2016;IRL;359;DUN Dundalk FC Dundalk;1.5
2015-2016;ALB;360;FLA KS Flamurtari Flamurtari;1.25
2015-2016;FIN;361;MYP Myllykosken Pallo -47 MYPA;1.0
2015-2016;MNE;362;TGD OFK Titograd Titograd;1.5
2015-2016;HUN;363;MTK MTK Budapest MTK;0.5
2015-2016;FRO;364;EBS EB/Streymur EB/Streymur;1.75
2015-2016;HUN;365;KEC Kecskeméti TE Kecskemét;0.5
2015-2016;MLT;366;HIB Hibernians FC Hibernians;1.75
2015-2016;LIE;367;ESC USV Eschen/Mauren Eschen/Mauren;0.25
2015-2016;ALB;368;LAC KF Laçi Laç;1.0
2015-2016;ARM;369;ULI Ulisses FC Ulisses;1.5
2015-2016;MDA;370;TIR FC Tiraspol Tiraspol;0.5
2015-2016;LVA;371;MET SK Liepājas Metalurgs Liepājas Metalurgs;1.25
2015-2016;ALB;372;TIR KF Tirana Tirana;1.0
2015-2016;MDA;373;ISK FC Iskra-Stal Iskra-Stal;0.5
2015-2016;ISL;374;THÓ Thór Akureyri Thór;0.5
2015-2016;FIN;375;TUR FC Inter Turku Inter Turku;0.75
2015-2016;FIN;376;TPS TPS Turku TPS;0.75
2015-2016;MKD;377;REN KF Renova Renova;1.0
2015-2016;WAL;378;BAN Bangor City FC Bangor;1.5
2015-2016;LTU;379;SUD FK Sūduva Sūduva;1.25
2015-2016;GEO;380;KUT FC Torpedo Kutaisi Torpedo Kutaisi;0.5
2015-2016;GEO;381;FC Gagra Gagra;0.5
2015-2016;IRL;382;DER Derry City FC Derry;1.0
2015-2016;MDA;383;SAX FC Saxan Saxan;0.25
2015-2016;MDA;384;SIN FC Veris Veris;0.25
2015-2016;LUX;385;JEU AS Jeunesse Esch Jeunesse Esch;1.0
2015-2016;ISL;386;VIK Víkingur Reykjavík Víkingur Reykjavík;0.25
2015-2016;ISL;387;FRA Fram Reykjavík Fram;0.25
2015-2016;FIN;388;VPS VPS Vaasa VPS;0.5
2015-2016;FIN;389;ROV RoPS Rovaniemi RoPS;0.5
2015-2016;FIN;390;JYV JJK Jyväskylä JJK;0.5
2015-2016;FRO;391;B36 B36 Tórshavn B36;1.25
2015-2016;MNE;392;FK Čelik Nikšić Čelik Nikšić;1.0
2015-2016;MNE;393;MOG FK Mogren Mogren;1.0
2015-2016;MKD;394;TUR FK Turnovo Turnovo;0.75
2015-2016;NIR;395;GLE Glentoran FC Glentoran;1.0
2015-2016;GEO;396;BAT FC Dinamo Batumi Dinamo Batumi;0.25
2015-2016;GEO;396;FC Tskhinvali Tskhinvali;0.25
2015-2016;GEO;398;SIO FC Sioni Bolnisi Sioni;0.25
2015-2016;IRL;399;BOH Bohemian FC Bohemians;0.75
2015-2016;LVA;400;JEL FK Jelgava Jelgava;0.75
2015-2016;ARM;401;MIK FC Mika Mika;1.0
2015-2016;ALB;402;TEU KF Teuta Teuta;0.5
2015-2016;ALB;403;VLL KF Vllaznia Vllaznia;0.5
2015-2016;FIN;404;LAH FC Lahti Lahti;0.25
2015-2016;FIN;404;SJK SJK Seinäjoki SJK;0.25
2015-2016;FIN;406;MAR IFK Mariehamn Mariehamn;0.25
2015-2016;GIB;407;LRI Lincoln Red Imps FC Lincoln Red Imps;1.5
2015-2016;AND;408;LUS FC Lusitans Lusitans;1.5
2015-2016;BIH;409;OLI FK Olimpic Sarajevo Olimpic Sarajevo;0.25
2015-2016;LTU;410;ATL FK Atlantas Atlantas;0.75
2015-2016;EST;411;SIL JK Sillamäe Kalev Sillamäe;0.75
2015-2016;EST;412;TRA JK Narva Trans Trans;0.75
2015-2016;IRL;413;UCD University College Dublin AFC UCD;0.5
2015-2016;LVA;414;SPA FK Spartaks Jūrmala Spartaks Jūrmala;0.5
2015-2016;ALB;415;PAR FK Partizani Partizani;0.25
2015-2016;ARM;416;URA FC Urartu Urartu;0.75
2015-2016;ARM;417;GAN FC Gandzasar Gandzasar;0.75
2015-2016;FRO;418;NSÍ NSÍ Runavík NSÍ;0.75
2015-2016;FRO;419;FUG ÍF Fuglafjørdur ÍF;0.75
2015-2016;MLT;420;FLO Floriana FC Floriana;0.75
2015-2016;WAL;421;AUK AUK Broughton FC Broughton;0.75
2015-2016;MKD;422;FK Teteks Teteks;0.25
2015-2016;WAL;423;LLA Llanelli AFC Llanelli;0.75
2015-2016;LTU;424;RIT FK Riteriai Riteriai;0.5
2015-2016;LTU;425;KRU FK Kruoja Kruoja;0.5
2015-2016;LTU;426;BAN FK Banga Banga;0.5
2015-2016;LTU;427;TAU FK Tauras Tauras;0.5
2015-2016;NIR;428;GLE Glenavon FC Glenavon;0.5
2015-2016;NIR;429;POR Portadown FC Portadown;0.5
2015-2016;IRL;430;COR Cork City FC Cork;0.25
2015-2016;IRL;431;DRO Drogheda United FC Drogheda;0.25
2015-2016;ARM;432;ALA Alashkert FC Alashkert;0.5
2015-2016;LVA;433;DAR FC Daugava Rīga Daugava Rīga;0.25
2015-2016;SMR;434;LAF La Fiorita 1967 La Fiorita;1.25
2015-2016;SMR;435;TRE SP Tre Penne SP Tre Penne;1.25
2015-2016;LUX;436;PRO FC Progrès Niederkorn Progrès;0.25
2015-2016;LUX;437;GRE CS Grevenmacher Grevenmacher;0.25
2015-2016;LUX;438;KAE UN Käerjéng 97 Käerjéng;0.25
2015-2016;MNE;439;FK Lovćen Lovćen;0.25
2015-2016;MLT;440;SLI Sliema Wanderers FC Sliema;0.5
2004-2005;ESP;1;RM Real Madrid CF Real Madrid;107.0
2004-2005;ESP;2;VAL Valencia CF Valencia;99.0
2004-2005;ITA;3;ACM AC Milan Milan;101.0
2004-2005;ESP;4;BAR FC Barcelona Barcelona;93.0
2004-2005;ENG;5;LIV Liverpool FC Liverpool;95.0
2004-2005;ENG;6;MU Manchester United Man. United;90.0
2004-2005;ITA;7;INT FC Internazionale Milano Inter;81.0
2004-2005;GER;8;BAY FC Bayern München Bayern;81.0
2004-2005;ESP;9;DEP Real Club Deportivo La Coruña Deportivo;72.0
2004-2005;ENG;10;ARS Arsenal FC Arsenal;73.0
2004-2005;POR;11;POR FC Porto Porto;79.0
2004-2005;ITA;12;JUV Juventus Juventus;73.0
2004-2005;NED;13;PSV PSV Eindhoven PSV;71.0
2004-2005;FRA;14;OL Olympique Lyonnais Lyon;65.0
2004-2005;ENG;15;NEW Newcastle United FC Newcastle;55.0
2004-2005;ITA;16;ASR AS Roma Roma;53.0
2004-2005;ITA;17;PAR Parma FC Parma;52.0
2004-2005;GRE;18;PAN Panathinaikos FC Panathinaikos;59.0
2004-2005;ITA;19;LAZ SS Lazio Lazio;49.0
2004-2005;ENG;20;CHE Chelsea FC Chelsea;48.0
2004-2005;GER;21;BL Bayer 04 Leverkusen Leverkusen;49.0
2004-2005;SCO;22;CEL Celtic FC Celtic;53.0
2004-2005;NED;23;FEY Feyenoord Feyenoord;49.0
2004-2005;ESP;24;VLR Villarreal CF Villarreal;34.0
2004-2005;GER;25;STU VfB Stuttgart Stuttgart;42.0
2004-2005;ESP;26;CEL RC Celta de Vigo Celta;33.0
2004-2005;GER;27;BVB Borussia Dortmund Dortmund;41.0
2004-2005;ENG;28;LEE Leeds United Leeds;36.0
2004-2005;FRA;29;BOR FC Girondins de Bordeaux Bordeaux;40.0
2004-2005;POR;30;SCP Sporting Clube de Portugal Sporting CP;41.0
2004-2005;FRA;31;MON AS Monaco FC Monaco;37.0
2004-2005;FRA;32;PAR Paris Saint-Germain Paris;37.0
2004-2005;NED;33;AJX AFC Ajax Ajax;39.0
2004-2005;FRA;34;AJA AJ Auxerre Auxerre;35.0
2004-2005;TUR;35;GAL Galatasaray AŞ Galatasaray;41.0
2004-2005;BEL;36;BRU Club Brugge Club Brugge;40.0
2004-2005;ESP;37;ALA Deportivo Alavés Alavés;26.0
2004-2005;GRE;38;AEK AEK Athens FC AEK;36.0
2004-2005;BEL;39;AND RSC Anderlecht Anderlecht;37.0
2004-2005;GRE;40;OLY Olympiacos FC Olympiacos;35.0
2004-2005;ESP;41;ZAR Real Zaragoza Zaragoza;22.0
2004-2005;GER;42;HER Hertha BSC Berlin Hertha;30.0
2004-2005;POR;43;BOA Boavista FC Boavista;31.0
2004-2005;GER;44;SCH FC Schalke 04 Schalke;28.0
2004-2005;CZE;45;SPP AC Sparta Praha Sparta Praha;34.0
2004-2005;FRA;46;LIL LOSC Lille LOSC;25.0
2004-2005;FRA;47;NAN FC Nantes Nantes;25.0
2004-2005;SCO;48;RAN Rangers FC Rangers;30.0
2004-2005;ESP;49;MAL RCD Mallorca Mallorca;16.0
2004-2005;ESP;50;MAL Málaga CF Málaga;16.0
2004-2005;UKR;51;DK FC Dynamo Kyiv Dynamo Kyiv;32.0
2004-2005;GER;52;BRM SV Werder Bremen Bremen;24.0
2004-2005;ESP;53;RAY Rayo Vallecano de Madrid Rayo Vallecano;15.0
2004-2005;RUS;54;LMO FC Lokomotiv Moskva Lokomotiv Moskva;30.0
2004-2005;TUR;55;BJK Beşiktaş JK Beşiktaş;28.0
2004-2005;NED;56;AZ AZ Alkmaar AZ Alkmaar;24.0
2004-2005;POR;57;SLB SL Benfica Benfica;22.0
2004-2005;NOR;58;RBK Rosenborg BK Rosenborg;30.0
2004-2005;ESP;59;SEV Sevilla FC Sevilla;12.0
2004-2005;FRA;60;OM Olympique de Marseille Marseille;20.0
2004-2005;GRE;61;PAO PAOK FC PAOK;24.0
2004-2005;FRA;62;SOC FC Sochaux-Montbéliard Sochaux;19.0
2004-2005;CZE;63;SLP SK Slavia Praha Slavia Praha;26.0
2004-2005;RUS;64;CSM PFC CSKA Moskva CSKA Moskva;26.0
2004-2005;ESP;65;BET Real Betis Balompié Betis;10.0
2004-2005;SUI;66;BSL FC Basel 1893 Basel;27.0
2004-2005;ENG;67;IPS Ipswich Town FC Ipswich;13.0
2004-2005;ESP;68;ATH Athletic Club Athletic Club;9.0
2004-2005;POL;69;WIS Wisła Kraków Wisła Kraków;26.0
2004-2005;ENG;70;MID Middlesbrough FC Middlesbrough;12.0
2004-2005;ESP;71;REA Real Sociedad de Fútbol Real Sociedad;8.0
2004-2005;CZE;72;LIB FC Slovan Liberec Liberec;23.0
2004-2005;RUS;73;SPM FC Spartak Moskva Spartak Moskva;23.0
2004-2005;GER;74;KAI 1. FC Kaiserslautern Kaiserslautern;15.0
2004-2005;ITA;75;UDI Udinese Calcio Udinese;10.0
2004-2005;SRB;76;PTZ FK Partizan Partizan;23.0
2004-2005;ESP;77;ESP RCD Espanyol Espanyol;5.0
2004-2005;FRA;78;LEN RC Lens Lens;13.0
2004-2005;ENG;79;FUL Fulham FC Fulham;8.0
2004-2005;UKR;80;SHK FC Shakhtar Donetsk Shakhtar Donetsk;20.0
2004-2005;ITA;81;PER AC Perugia Perugia;8.0
2004-2005;AUT;82;AUS FK Austria Wien Austria Wien;19.0
2004-2005;ITA;83;FIO ACF Fiorentina Fiorentina;7.0
2004-2005;CRO;84;DZ GNK Dinamo Zagreb Dinamo Zagreb;21.0
2004-2005;ENG;85;MC Manchester City FC Man. City;6.0
2004-2005;ISR;86;HTA Hapoel Tel-Aviv FC H. Tel-Aviv;19.0
2004-2005;AUT;87;STM SK Sturm Graz Sturm;18.0
2004-2005;NED;88;HVN sc Heerenveen Heerenveen;13.0
2004-2005;AUT;89;GRA Grazer AK GAK;17.0
2004-2005;GER;90;ALE TSV Alemannia Aachen Aachen;9.0
2004-2005;UKR;91;DNI FC Dnipro Dnipro;16.0
2004-2005;GER;92;HSV Hamburger SV Hamburg;8.0
2004-2005;NED;93;UTR FC Utrecht Utrecht;11.0
2004-2005;TUR;94;FEN Fenerbahçe SK Fenerbahçe;14.0
2004-2005;TUR;95;GCB Gençlerbirliği SK Gençlerbirliği;14.0
2004-2005;ENG;96;BLA Blackburn Rovers FC Blackburn;3.0
2004-2005;NED;97;VIT Vitesse Vitesse;10.0
2004-2005;NED;98;ROD Roda JC Roda;10.0
2004-2005;ENG;99;AV Aston Villa FC Aston Villa;2.0
2004-2005;SCO;100;HEA Heart of Midlothian FC Hearts;12.0
2004-2005;GER;101;FRE SC Freiburg Freiburg;6.0
2004-2005;GER;102;MUN TSV 1860 München 1860 München;6.0
2004-2005;ENG;103;MIL Millwall FC Millwall;1.0
2004-2005;ENG;104;SOU Southampton FC Southampton;1.0
2004-2005;ENG;105;LEI Leicester City FC Leicester;1.0
2004-2005;ISR;106;MHA Maccabi Haifa FC M. Haifa;14.0
2004-2005;ITA;107;CHI AC Chievo Verona Chievo;1.0
2004-2005;SRB;108;CRV FK Crvena zvezda Crvena zvezda;14.0
2004-2005;TUR;109;GAZ Gaziantepspor Gaziantepspor;11.0
2004-2005;FRA;110;TRO ES Troyes AC Troyes;4.0
2004-2005;GER;111;UNI 1. FC Union Berlin Union Berlin;4.0
2004-2005;ROU;112;SB FCSB FCSB;15.0
2004-2005;GRE;113;PAN Panionios GSS Panionios;8.0
2004-2005;DEN;114;BIF Brøndby IF Brøndby;14.0
2004-2005;BEL;115;GNK KRC Genk Genk;9.0
2004-2005;ISR;116;MTA Maccabi Tel-Aviv FC M. Tel-Aviv;12.0
2004-2005;NED;117;TWE FC Twente Twente;6.0
2004-2005;CRO;118;OSI NK Osijek Osijek;13.0
2004-2005;SUI;119;GCZ Grasshopper Club Zürich Grasshoppers;12.0
2004-2005;SUI;120;SER Servette FC Servette;12.0
2004-2005;POR;121;MRT CS Marítimo Marítimo;4.0
2004-2005;GRE;122;IRA Iraklis FC Iraklis;7.0
2004-2005;BEL;123;STD R. Standard de Liège Standard Liège;8.0
2004-2005;RUS;124;ZEN FC Zenit Zenit;10.0
2004-2005;HUN;125;FER Ferencvárosi TC Ferencváros;13.0
2004-2005;FRA;126;LOR FC Lorient Lorient;2.0
2004-2005;FRA;127;SED CS Sedan-Ardennes Sedan;2.0
2004-2005;CZE;128;TEP FK Teplice Teplice;9.0
2004-2005;GER;129;BOC VfL Bochum 1848 Bochum;2.0
2004-2005;BUL;130;LS PFC Levski Sofia Levski;12.0
2004-2005;TUR;131;DEN Denizlispor Denizlispor;8.0
2004-2005;FRA;132;STR Racing Club de Strasbourg Alsace Strasbourg;1.0
2004-2005;FRA;133;GUE FC Gueugnon Gueugnon;1.0
2004-2005;AUT;134;INN FC Wacker Innsbruck Wacker;9.0
2004-2005;POL;135;LEC KKS Lech Poznań Lech;10.0
2004-2005;POL;136;LEG Legia Warszawa Legia;10.0
2004-2005;POR;137;LEI UD Leiria Leiria;2.0
2004-2005;POR;138;LEI Leixões SC Leixões;2.0
2004-2005;FRA;139;CHÂ LB Châteauroux Châteauroux;0.0
2004-2005;POR;140;SCB SC Braga Braga;1.0
2004-2005;GRE;141;EGA Egaleo FC Egaleo;4.0
2004-2005;GRE;142;ARI Aris Thessaloniki FC Aris;4.0
2004-2005;GRE;143;OFI OFI Crete FC OFI;4.0
2004-2005;DEN;144;CPH F.C. Copenhagen Copenhagen;10.0
2004-2005;AUT;145;RPD SK Rapid Wien Rapid Wien;7.0
2004-2005;BUL;146;CSS PFC CSKA Sofia CSKA Sofia;9.0
2004-2005;SUI;147;STG FC St. Gallen St. Gallen;8.0
2004-2005;POR;148;NCL CD Nacional Nacional;0.0
2004-2005;HUN;149;DEB Debreceni VSC Debrecen;9.0
2004-2005;BUL;150;LTX PFC Litex Lovech Litex;8.0
2004-2005;SUI;151;LAU FC Lausanne-Sport Lausanne;7.0
2004-2005;BEL;152;BEV KSK Beveren Beveren;3.0
2004-2005;RUS;153;TOR FC Torpedo Moskva Torpedo Moskva;5.0
2004-2005;RUS;154;DM FC Dynamo Moscow Dynamo Moscow;5.0
2004-2005;NED;155;NIJ NEC Nijmegen NEC;0.0
2004-2005;NED;155;NAC NAC Breda NAC;0.0
2004-2005;SWE;157;HAL Halmstads BK Halmstad;8.0
2004-2005;SWE;157;HEL Helsingborgs IF Helsingborg;8.0
2004-2005;TUR;159;TRA Trabzonspor AŞ Trabzonspor;3.0
2004-2005;GRE;160;XAN Xanthi FC Xanthi;1.0
2004-2005;NOR;161;VIK Viking FK Viking;6.0
2004-2005;SCO;162;LIV Livingston FC Livingston;2.0
2004-2005;SCO;163;HIB Hibernian FC Hibernian;2.0
2004-2005;CZE;164;ŽIŽ FK Viktoria Žižkov Žižkov;3.0
2004-2005;CZE;165;PRI 1. FK Příbram Příbram;3.0
2004-2005;ROU;166;DB FC Dinamo Bucureşti Dinamo Bucureşti;7.0
2004-2005;POL;167;GRO Groclin Grodzisk Wielkopolski Groclin Grodzisk Wielkopolski;5.0
2004-2005;TUR;168;YMA Yeni Malatyaspor Yeni Malatyaspor;2.0
2004-2005;TUR;169;ANT Antalyaspor Antalyaspor;2.0
2004-2005;NOR;170;VÅL Vålerenga Fotball Vålerenga;5.0
2004-2005;BEL;171;LOU RAA Louviéroise La Louvière;1.0
2004-2005;SCO;172;ABE Aberdeen FC Aberdeen;1.0
2004-2005;BEL;173;MOU R. Excelsior Mouscron Mouscron;1.0
2004-2005;SCO;174;KIL Kilmarnock FC Kilmarnock;1.0
2004-2005;BEL;175;LIE K. Lierse SK Lierse;1.0
2004-2005;CZE;176;SIG SK Sigma Olomouc Sigma;2.0
2004-2005;AUT;177;KÄR FC Kärnten Kärnten;3.0
2004-2005;UKR;178;ARS FC Arsenal Kyiv Arsenal Kyiv;3.0
2004-2005;CRO;179;HAJ HNK Hajduk Split Hajduk Split;5.0
2004-2005;CRO;180;VAR NK Varaždin Varaždin;5.0
2004-2005;DEN;181;VIB Viborg FF Viborg;5.0
2004-2005;DEN;181;HER Herfølge BK Herfølge BK;5.0
2004-2005;SCO;183;DUN Dundee FC Dundee;0.0
2004-2005;BEL;184;LOK KSC Lokeren OV Lokeren;0.0
2004-2005;BEL;185;WES KVC Westerlo Westerlo;0.0
2004-2005;BEL;186;GNT KAA Gent Gent;0.0
2004-2005;CZE;187;BNK FC Baník Ostrava Baník;1.0
2004-2005;CZE;188;DRN 1. FK Drnovice Drnovice;1.0
2004-2005;AUT;189;SBG FC Salzburg Salzburg;2.0
2004-2005;UKR;190;MET FC Metalurh Donetsk Metalurh Donetsk;2.0
2004-2005;SWE;191;DJU Djurgårdens IF Djurgården;5.0
2004-2005;TUR;192;KOC Kocaelispor Kocaelispor;0.0
2004-2005;TUR;192;ANK MKE Ankaragücü Ankaragücü;0.0
2004-2005;SVK;194;SEN FK Senica Senica;6.0
2004-2005;NOR;195;MOL Molde FK Molde;3.0
2004-2005;NOR;196;LIL Lillestrøm SK Lillestrøm;3.0
2004-2005;RUS;197;TER FC Akhmat Grozny Akhmat;1.0
2004-2005;UKR;198;ZAP FC Metalurh Zaporizhya Metalurh Zaporizhya;1.0
2004-2005;POL;199;POL KSP Polonia Warszawa Polonia Warszawa;2.0
2004-2005;DEN;200;OB Odense BK OB;3.0
2004-2005;DEN;201;MID FC Midtjylland Midtjylland;3.0
2004-2005;NOR;202;STA Stabæk Fotball Stabæk;2.0
2004-2005;NOR;203;ODD Odds BK Odd;2.0
2004-2005;NOR;204;LYN FK Lyn Lyn;2.0
2004-2005;RUS;205;CHE FC Chernomorets Novorossiisk Chernomorets;0.0
2004-2005;RUS;205;ANJ FC Anji Anji;0.0
2004-2005;RUS;207;ALA FC Alania Vladikavkaz Alania;0.0
2004-2005;HUN;208;MTK MTK Budapest MTK;3.0
2004-2005;ISR;209;JER Beitar Jerusalem FC Beitar Jerusalem;1.0
2004-2005;UKR;210;KRY FC Kryvbas Kryvyi Rih Kryvbas;0.0
2004-2005;UKR;210;VOR FC Vorskla Poltava Vorskla;0.0
2004-2005;ROU;212;RAP FC Rapid Bucureşti Rapid Bucureşti;3.0
2004-2005;SRB;213;SME FK Smederevo Smederevo;1.0
2004-2005;SRB;214;OBI FK Obilic FK Obilic;1.0
2004-2005;SRB;215;NAP FK Napredak Napredak;1.0
2004-2005;NOR;216;BOD FK Bodø/Glimt Bodø/Glimt;1.0
2004-2005;NOR;217;BRA SK Brann Brann;1.0
2004-2005;ISR;218;MAC Maccabi Petah Tikva FC M. Petah Tikva;0.0
2004-2005;ISR;218;HAP Bnei Sakhnin FC Bnei Sakhnin;0.0
2004-2005;ISR;220;HAP Hapoel Ramat Gan FC H. Ramat Gan;0.0
2004-2005;SVN;221;OLI NK Olimpija Ljubljana Olimpija Ljubljana;4.0
2004-2005;BUL;222;NAF PFC Naftex Burgas Naftex;1.0
2004-2005;ROU;223;NAT FC Naţional Bucureşti FC Naţional Bucureşti;2.0
2004-2005;SWE;224;AIK AIK AIK;2.0
2004-2005;CRO;225;KAM NK Kamen Ingrad Kamen Ingrad;1.0
2004-2005;CRO;226;RIJ HNK Rijeka Rijeka;1.0
2004-2005;POL;227;RUC Ruch Chorzów Ruch;0.0
2004-2005;SUI;228;XAM Neuchâtel Xamax FC Xamax;0.0
2004-2005;SUI;229;FCZ FC Zürich Zürich;0.0
2004-2005;SVK;230;SVB ŠK Slovan Bratislava Slovan Bratislava;3.0
2004-2005;DEN;231;AAL Aalborg BK AaB;1.0
2004-2005;DEN;232;ESB Esbjerg fB Esbjerg;1.0
2004-2005;HUN;233;VAS Vasas FC Vasas;1.0
2004-2005;SWE;234;ELF IF Elfsborg Elfsborg;1.0
2004-2005;SWE;235;NOR IFK Norrköping FK Norrköping;1.0
2004-2005;SWE;235;ÖRG Örgryte IS Örgryte;1.0
2004-2005;SVK;237;PUC FK Matador Púchov Púchov;2.0
2004-2005;SVK;238;RUZ MFK Ružomberok Ružomberok;2.0
2004-2005;CYP;239;APO APOEL FC APOEL;3.0
2004-2005;DEN;240;NRS FC Nordsjælland Nordsjælland;0.0
2004-2005;DEN;241;SIL Silkeborg IF Silkeborg;0.0
2004-2005;DEN;242;AB Akademisk Boldklub AB;0.0
2004-2005;HUN;243;UJP Újpest FC Újpest;0.0
2004-2005;HUN;244;ZTE Zalaegerszegi TE Zalaegerszeg;0.0
2004-2005;HUN;245;DUN Dunaferr SE Dunaferr;0.0
2004-2005;ROU;246;BRA FC Braşov Braşov;0.0
2004-2005;SWE;247;HAM Hammarby Fotboll Hammarby;0.0
2004-2005;SWE;248;MAL Malmö FF Malmö;0.0
2004-2005;SVK;249;PET FC Petržalka Petržalka;1.0
2004-2005;SVK;250;KOS MFK Košice Košice;1.0
2004-2005;CYP;251;ANO Anorthosis Famagusta FC Anorthosis;2.0
2004-2005;BIH;252;ŽEL FK Željezničar Željezničar;2.0
2004-2005;SVN;253;GOR ND Gorica Gorica;1.0
2004-2005;SVN;254;MBR NK Maribor Maribor;1.0
2004-2005;SVN;255;CJE NK Celje Celje;1.0
2004-2005;FIN;256;HJK HJK Helsinki HJK;2.0
2004-2005;GEO;257;DIN FC Dinamo Tbilisi Dinamo Tbilisi;2.0
2004-2005;SVK;258;DUK FK Dukla Banská Bystrica Banská Bystrica;0.0
2004-2005;SVK;259;ZIL MŠK Žilina Žilina;0.0
2004-2005;CYP;260;NIC Olympiakos Nicosia FC Olympiakos;1.0
2004-2005;IRL;261;BOH Bohemian FC Bohemians;2.0
2004-2005;BIH;262;SAR FK Sarajevo Sarajevo;1.0
2004-2005;LVA;263;VEN FK Ventspils Ventspils;1.0
2004-2005;SVN;264;PRI NK Primorje Primorje;0.0
2004-2005;FIN;265;HAK Valkeakosken Haka Haka;1.0
2004-2005;MDA;266;ZIM FC Zimbru Chisinau Zimbru;1.0
2004-2005;CYP;267;APO Apollon Limassol FC Apollon;0.0
2004-2005;ISL;268;HAF FH Hafnarfjördur FH;1.0
2004-2005;MKD;269;VAR FK Vardar Vardar;1.0
2004-2005;IRL;270;SHE Shelbourne FC Shelbourne;1.0
2004-2005;BIH;271;ŠIR NK Široki Brijeg Široki Brijeg;0.0
2004-2005;LVA;272;MET SK Liepājas Metalurgs Liepājas Metalurgs;0.0
2004-2005;FIN;273;MYP Myllykosken Pallo -47 MYPA;0.0
2004-2005;MLT;274;BIR Birkirkara FC Birkirkara;1.0
2004-2005;LTU;275;SUD FK Sūduva Sūduva;0.0
2004-2005;ISL;276;FYL Fylkir Fylkir;0.0
2004-2005;MKD;277;CEM FK Cementarnica 55 Cementarnica;0.0
2004-2005;MKD;278;POB FK Pobeda Pobeda;0.0
2004-2005;BLR;279;GOM FC Gomel Gomel;0.0
2004-2005;BLR;280;BTE FC BATE Borisov BATE;0.0
2005-2006;ITA;1;ACM AC Milan Milan;107.0
2005-2006;ESP;2;BAR FC Barcelona Barcelona;103.0
2005-2006;ESP;3;RM Real Madrid CF Real Madrid;96.0
2005-2006;ITA;4;INT FC Internazionale Milano Inter;90.0
2005-2006;ITA;5;JUV Juventus Juventus;85.0
2005-2006;ENG;6;LIV Liverpool FC Liverpool;85.0
2005-2006;ENG;7;ARS Arsenal FC Arsenal;81.0
2005-2006;ENG;8;MU Manchester United Man. United;80.0
2005-2006;ESP;9;VAL Valencia CF Valencia;71.0
2005-2006;FRA;10;OL Olympique Lyonnais Lyon;73.0
2005-2006;POR;11;POR FC Porto Porto;73.0
2005-2006;NED;12;PSV PSV Eindhoven PSV;68.0
2005-2006;GER;13;BAY FC Bayern München Bayern;65.0
2005-2006;ENG;14;CHE Chelsea FC Chelsea;59.0
2005-2006;ESP;15;VLR Villarreal CF Villarreal;53.0
2005-2006;ESP;16;DEP Real Club Deportivo La Coruña Deportivo;53.0
2005-2006;ITA;17;ASR AS Roma Roma;54.0
2005-2006;ENG;18;NEW Newcastle United FC Newcastle;55.0
2005-2006;GRE;19;PAN Panathinaikos FC Panathinaikos;56.0
2005-2006;GER;20;SCH FC Schalke 04 Schalke;49.0
2005-2006;ITA;21;PAR Parma FC Parma;41.0
2005-2006;ESP;22;SEV Sevilla FC Sevilla;37.0
2005-2006;NED;23;AJX AFC Ajax Ajax;47.0
2005-2006;SCO;24;CEL Celtic FC Celtic;50.0
2005-2006;GER;25;STU VfB Stuttgart Stuttgart;44.0
2005-2006;FRA;26;MON AS Monaco FC Monaco;42.0
2005-2006;GER;27;BL Bayer 04 Leverkusen Leverkusen;42.0
2005-2006;ITA;28;LAZ SS Lazio Lazio;35.0
2005-2006;GER;29;BVB Borussia Dortmund Dortmund;41.0
2005-2006;FRA;30;LIL LOSC Lille LOSC;38.0
2005-2006;NED;31;FEY Feyenoord Feyenoord;41.0
2005-2006;POR;32;SCP Sporting Clube de Portugal Sporting CP;40.0
2005-2006;ENG;33;MID Middlesbrough FC Middlesbrough;33.0
2005-2006;FRA;34;AJA AJ Auxerre Auxerre;37.0
2005-2006;POR;35;SLB SL Benfica Benfica;37.0
2005-2006;BEL;36;BRU Club Brugge Club Brugge;40.0
2005-2006;SUI;37;BSL FC Basel 1893 Basel;41.0
2005-2006;FRA;38;OM Olympique de Marseille Marseille;32.0
2005-2006;NED;39;AZ AZ Alkmaar AZ Alkmaar;35.0
2005-2006;FRA;40;BOR FC Girondins de Bordeaux Bordeaux;31.0
2005-2006;GER;41;HER Hertha BSC Berlin Hertha;31.0
2005-2006;ROU;42;SB FCSB FCSB;36.0
2005-2006;ESP;43;BET Real Betis Balompié Betis;21.0
2005-2006;CZE;44;SPP AC Sparta Praha Sparta Praha;36.0
2005-2006;ESP;45;ZAR Real Zaragoza Zaragoza;20.0
2005-2006;GER;46;BRM SV Werder Bremen Bremen;28.0
2005-2006;GRE;47;OLY Olympiacos FC Olympiacos;33.0
2005-2006;SCO;48;RAN Rangers FC Rangers;33.0
2005-2006;ESP;49;CEL RC Celta de Vigo Celta;19.0
2005-2006;RUS;50;CSM PFC CSKA Moskva CSKA Moskva;32.0
2005-2006;FRA;51;PAR Paris Saint-Germain Paris;25.0
2005-2006;RUS;52;LMO FC Lokomotiv Moskva Lokomotiv Moskva;31.0
2005-2006;POR;53;BOA Boavista FC Boavista;26.0
2005-2006;ESP;54;MAL RCD Mallorca Mallorca;16.0
2005-2006;ESP;55;MAL Málaga CF Málaga;16.0
2005-2006;FRA;56;LEN RC Lens Lens;23.0
2005-2006;GRE;57;AEK AEK Athens FC AEK;29.0
2005-2006;BEL;58;AND RSC Anderlecht Anderlecht;29.0
2005-2006;TUR;59;BJK Beşiktaş JK Beşiktaş;30.0
2005-2006;RUS;60;ZEN FC Zenit Zenit;27.0
2005-2006;ITA;61;UDI Udinese Calcio Udinese;15.0
2005-2006;ENG;62;LEE Leeds United Leeds;16.0
2005-2006;UKR;63;DK FC Dynamo Kyiv Dynamo Kyiv;28.0
2005-2006;ITA;64;PAL US Città di Palermo Palermo;14.0
2005-2006;NOR;65;RBK Rosenborg BK Rosenborg;29.0
2005-2006;FRA;66;SOC FC Sochaux-Montbéliard Sochaux;19.0
2005-2006;BUL;67;LS PFC Levski Sofia Levski;27.0
2005-2006;ENG;68;IPS Ipswich Town FC Ipswich;13.0
2005-2006;UKR;69;SHK FC Shakhtar Donetsk Shakhtar Donetsk;25.0
2005-2006;CZE;70;SLP SK Slavia Praha Slavia Praha;25.0
2005-2006;TUR;71;GAL Galatasaray AŞ Galatasaray;25.0
2005-2006;GRE;72;PAO PAOK FC PAOK;23.0
2005-2006;ESP;73;ESP RCD Espanyol Espanyol;9.0
2005-2006;ESP;74;ATH Athletic Club Athletic Club;9.0
2005-2006;ESP;75;REA Real Sociedad de Fútbol Real Sociedad;8.0
2005-2006;FRA;76;STR Racing Club de Strasbourg Alsace Strasbourg;15.0
2005-2006;GER;77;HSV Hamburger SV Hamburg;15.0
2005-2006;ENG;78;BOL Bolton Wanderers FC Bolton;10.0
2005-2006;NED;79;HVN sc Heerenveen Heerenveen;17.0
2005-2006;SRB;80;PTZ FK Partizan Partizan;24.0
2005-2006;ROU;81;RAP FC Rapid Bucureşti Rapid Bucureşti;20.0
2005-2006;ITA;82;PER AC Perugia Perugia;8.0
2005-2006;UKR;83;DNI FC Dnipro Dnipro;21.0
2005-2006;POL;84;WIS Wisła Kraków Wisła Kraków;23.0
2005-2006;ITA;85;SAM UC Sampdoria Sampdoria;7.0
